<?xml version="1.0" encoding="UTF-8"?>
<dataroot xmlns:od="urn:schemas-microsoft-com:officedata" generated="2016-01-06T18:03:02">
<tblNotes>
<noteID>182</noteID>
<CandID>12</CandID>
<noteDate>2009-01-05T00:00:00</noteDate>
<note>1/5/09:  LLD reported on mixed ref checks from Dubai and UNC advisor; CB to follow up w/DHD; possible 2nd visit?</note>
</tblNotes>
<tblNotes>
<noteID>184</noteID>
<CandID>26</CandID>
<noteDate>2009-01-05T00:00:00</noteDate>
<note>1/5/09:  CB to do TC w/candidate to further explore teaching and future goals.</note>
</tblNotes>
<tblNotes>
<noteID>185</noteID>
<CandID>34</CandID>
<noteDate>2009-02-02T00:00:00</noteDate>
<note>Pass, send regret ltr.</note>
</tblNotes>
<tblNotes>
<noteID>186</noteID>
<CandID>39</CandID>
<noteDate>2009-02-02T00:00:00</noteDate>
<note>2/2/09:  LLD to do phone interview.</note>
</tblNotes>
<tblNotes>
<noteID>187</noteID>
<CandID>40</CandID>
<noteDate>2009-02-02T00:00:00</noteDate>
<note>no significant related experience;  regret ltr sent 2/2.  CLOSED</note>
</tblNotes>
<tblNotes>
<noteID>188</noteID>
<CandID>43</CandID>
<noteDate>2009-02-02T00:00:00</noteDate>
<note>not qualified for researcher position; DP to review materials and possibly contact candidate if a match exists with gero shared position.  DP concluded:  More teacher than scientist; no indepth scientific studies that would match needs of shared gero postion.</note>
</tblNotes>
<tblNotes>
<noteID>189</noteID>
<CandID>44</CandID>
<noteDate>2009-02-02T00:00:00</noteDate>
<note>LLD to do phone interview.</note>
</tblNotes>
<tblNotes>
<noteID>190</noteID>
<CandID>45</CandID>
<noteDate>2009-02-02T00:00:00</noteDate>
<note>2/2/09:  unqualified candidate;  regret ltr  sent 2/2/09.</note>
</tblNotes>
<tblNotes>
<noteID>191</noteID>
<CandID>46</CandID>
<noteDate>2009-02-02T00:00:00</noteDate>
<note>LLD to phone following calls to Tian and Silva.  Other candidates identified as more qualified;</note>
</tblNotes>
<tblNotes>
<noteID>192</noteID>
<CandID>50</CandID>
<noteDate>2009-02-02T00:00:00</noteDate>
<note>not a strong match to current needs; encourage to reapply closer to grad date; CB to call to advise of recommendation.</note>
</tblNotes>
<tblNotes>
<noteID>193</noteID>
<CandID>51</CandID>
<noteDate>2009-02-02T00:00:00</noteDate>
<note>2/2/09:  CB had telephone interview; regret ltr sent 2/2.</note>
</tblNotes>
<tblNotes>
<noteID>194</noteID>
<CandID>52</CandID>
<noteDate>2009-02-02T00:00:00</noteDate>
<note>2/2/09:  TV to do telephone interview.</note>
</tblNotes>
<tblNotes>
<noteID>195</noteID>
<CandID>53</CandID>
<noteDate>2009-02-02T00:00:00</noteDate>
<note>2/209:  previous candidate from fall 08/sent regret ltr; DP to contact to candidate (? about progress since last application);</note>
</tblNotes>
<tblNotes>
<noteID>196</noteID>
<CandID>54</CandID>
<noteDate>2009-02-02T00:00:00</noteDate>
<note>2/2/09: CB to conduct telephone interview (determine candidate&apos;s goals).</note>
</tblNotes>
<tblNotes>
<noteID>197</noteID>
<CandID>55</CandID>
<noteDate>2009-02-02T00:00:00</noteDate>
<note>2/2/09: Pass, regret ltr sent 2/2.</note>
</tblNotes>
<tblNotes>
<noteID>198</noteID>
<CandID>56</CandID>
<noteDate>2009-02-02T00:00:00</noteDate>
<note>2/2/09:  not a strong fit; regret ltr to sent 2/2.</note>
</tblNotes>
<tblNotes>
<noteID>199</noteID>
<CandID>57</CandID>
<noteDate>2009-01-05T00:00:00</noteDate>
<note>1/5/09:  very jr candidate; unable to relocate until 9/09; DB to do ref checks.</note>
</tblNotes>
<tblNotes>
<noteID>200</noteID>
<CandID>59</CandID>
<noteDate>2008-08-04T00:00:00</noteDate>
<note>8/4/08:  DB to do phone interview; candidate wants to teach, see pts, do research;  DB to keep warm;</note>
</tblNotes>
<tblNotes>
<noteID>201</noteID>
<CandID>60</CandID>
<noteDate>2009-03-06T00:00:00</noteDate>
<note>Experience not a match to posted positions.  Regret ltr sent 3/6/09.</note>
</tblNotes>
<tblNotes>
<noteID>202</noteID>
<CandID>62</CandID>
<noteDate>2009-03-02T00:00:00</noteDate>
<note>3/2/09:  Revisit following Silva visit on 3/17.</note>
</tblNotes>
<tblNotes>
<noteID>203</noteID>
<CandID>63</CandID>
<noteDate>2009-03-02T00:00:00</noteDate>
<note>3/2/09:  DP has reviewed, recommends an interview; DP to do phone interview w/candidate.  Committee members to review and post comments; DP to do telephone call w/candidate 3/25/09. Summary of References under Comments</note>
</tblNotes>
<tblNotes>
<noteID>204</noteID>
<CandID>64</CandID>
<noteDate>2009-03-02T00:00:00</noteDate>
<note>3/2/09: not acute care; ?s about practice; merits phone interview; DB to contact candidate after 3/17.</note>
</tblNotes>
<tblNotes>
<noteID>205</noteID>
<CandID>66</CandID>
<noteDate>2009-03-02T00:00:00</noteDate>
<note>3/2/09:  Committee members to review and post comments. Initial phone screen conducted 3/16 CB.</note>
</tblNotes>
<tblNotes>
<noteID>206</noteID>
<CandID>67</CandID>
<noteDate>2009-04-13T00:00:00</noteDate>
<note>4/13/09:  chair to f/u with dean</note>
</tblNotes>
<tblNotes>
<noteID>207</noteID>
<CandID>68</CandID>
<noteDate>2009-04-13T00:00:00</noteDate>
<note>4/13/09:  regret ltr to be sent; ltr sent 4/17/09</note>
</tblNotes>
<tblNotes>
<noteID>208</noteID>
<CandID>69</CandID>
<noteDate>2009-04-13T00:00:00</noteDate>
<note>recommend regret ltr; ltr sent 4/17/09.</note>
</tblNotes>
<tblNotes>
<noteID>209</noteID>
<CandID>70</CandID>
<noteDate>2009-04-13T00:00:00</noteDate>
<note>4/13/09:  recommend telephone interview - DLP to call candidate.</note>
</tblNotes>
<tblNotes>
<noteID>210</noteID>
<CandID>71</CandID>
<noteDate>2009-03-13T00:00:00</noteDate>
<note>3/13/09:  I want to hold on active recruitment until we meet with Dr. Woods late next week.
Cg</note>
</tblNotes>
<tblNotes>
<noteID>211</noteID>
<CandID>72</CandID>
<noteDate>2009-04-13T00:00:00</noteDate>
<note>4/13/09:  chair to communicate to dean and ADAA re:  status of DAST position</note>
</tblNotes>
<tblNotes>
<noteID>212</noteID>
<CandID>74</CandID>
<noteDate>2009-08-04T00:00:00</noteDate>
<note>8/4/08. Bailey will chat with her re: on hold for new faculty hires at this time.
Discuss 9/8. LLD  HOLD</note>
</tblNotes>
<tblNotes>
<noteID>213</noteID>
<CandID>75</CandID>
<noteDate>2009-04-13T00:00:00</noteDate>
<note>4/13/09:  recommend regret ltr be sent;</note>
</tblNotes>
<tblNotes>
<noteID>215</noteID>
<CandID>77</CandID>
<noteDate>2009-04-13T00:00:00</noteDate>
<note>4/13/09:  prior to recommending campus interview, inquire of dean:  where will here home be; how to interview vis a vi TI?</note>
</tblNotes>
<tblNotes>
<noteID>216</noteID>
<CandID>78</CandID>
<noteDate>2009-04-13T00:00:00</noteDate>
<note>4/13/09:  recommend regret ltr;</note>
</tblNotes>
<tblNotes>
<noteID>217</noteID>
<CandID>79</CandID>
<noteDate>2009-04-13T00:00:00</noteDate>
<note>4/13/09: regret ltr to be sent (not doctorally prepared);</note>
</tblNotes>
<tblNotes>
<noteID>218</noteID>
<CandID>80</CandID>
<noteDate>2009-05-04T00:00:00</noteDate>
<note>5/4/09:  pending DP and LLD comments 5/08/09: PASS;</note>
</tblNotes>
<tblNotes>
<noteID>220</noteID>
<CandID>82</CandID>
<noteDate>2009-05-04T00:00:00</noteDate>
<note>5/4/09:  not a viable candidate for researcher; pending DP and LLD comments</note>
</tblNotes>
<tblNotes>
<noteID>221</noteID>
<CandID>83</CandID>
<noteDate>2009-05-04T00:00:00</noteDate>
<note>5/4/09:  pending LLD and DP comments</note>
</tblNotes>
<tblNotes>
<noteID>222</noteID>
<CandID>84</CandID>
<noteDate>2009-05-04T00:00:00</noteDate>
<note>5/4/09:  candidate&apos;s nsg program to end 2010; hold pending DP and LLD comments.</note>
</tblNotes>
<tblNotes>
<noteID>223</noteID>
<CandID>86</CandID>
<noteDate>2009-06-01T00:00:00</noteDate>
<note>6/1/09:  not a good fit; send regret letter;</note>
</tblNotes>
<tblNotes>
<noteID>224</noteID>
<CandID>87</CandID>
<noteDate>2009-06-01T00:00:00</noteDate>
<note>6/1/09:  search comm chair to forward CV to DTS for review/CI interest. Forwarded to DTS 6/15 CB.</note>
</tblNotes>
<tblNotes>
<noteID>225</noteID>
<CandID>88</CandID>
<noteDate>2008-07-14T00:00:00</noteDate>
<note> Candidate originally submitted materials for CRM position; 8/4/08:   DB to do phone interview; candidate wants to teach, see pts, do research;  DB to keep warm; per TC wDHB candidate is interested in peds ABSN program position</note>
</tblNotes>
<tblNotes>
<noteID>226</noteID>
<CandID>89</CandID>
<noteDate>2009-06-01T00:00:00</noteDate>
<note>6/1/09:  CB to forward CV to DTS for review. CV forwarded 7/5.</note>
</tblNotes>
<tblNotes>
<noteID>227</noteID>
<CandID>90</CandID>
<noteDate>2009-06-01T00:00:00</noteDate>
<note>revisit at July mtg.</note>
</tblNotes>
<tblNotes>
<noteID>228</noteID>
<CandID>91</CandID>
<noteDate>2009-08-17T00:00:00</noteDate>
<note>Regret ltr sent</note>
</tblNotes>
<tblNotes>
<noteID>229</noteID>
<CandID>92</CandID>
<noteDate>2009-07-06T00:00:00</noteDate>
<note>Hold pending candidate&apos;s defense in Aug 09.</note>
</tblNotes>
<tblNotes>
<noteID>230</noteID>
<CandID>94</CandID>
<noteDate>2009-07-06T00:00:00</noteDate>
<note>Committee suggests HG review CV re:  ob teaching/clinical  exp; pending HG&apos;s review,  DP to advise candidate of inexperience re:  RN/researcher position; determine interest in ABSN position (ob) position; if interested candidate should resubmit separate ltr (and possibly additional references).
8/3/09:  candidate not interested in ABSN program; regret ltr to be sent.
8/17/09:  regret ltr sent.</note>
</tblNotes>
<tblNotes>
<noteID>231</noteID>
<CandID>95</CandID>
<noteDate>2009-07-06T00:00:00</noteDate>
<note>DP to check references; candidate not interested in teaching psych;  re:  ABSN program (comm health); candidate accepted another position.</note>
</tblNotes>
<tblNotes>
<noteID>232</noteID>
<CandID>96</CandID>
<noteDate>2009-07-06T00:00:00</noteDate>
<note>7/6/09: possible contibutor to ABSN or DNP program; CB to contact candidate re:  UAB reference; pending ok from candidate DP to contact UAB dean.</note>
</tblNotes>
<tblNotes>
<noteID>233</noteID>
<CandID>97</CandID>
<noteDate>2009-07-06T00:00:00</noteDate>
<note>committee recommends regret ltr due to inexperiences in technology/ed; regret ltr sent 7/14/09 CA.</note>
</tblNotes>
<tblNotes>
<noteID>234</noteID>
<CandID>98</CandID>
<noteDate>2009-07-06T00:00:00</noteDate>
<note>committee recommends regret ltr due to inexperience; regret ltr sent 7/13/09 CA.</note>
</tblNotes>
<tblNotes>
<noteID>235</noteID>
<CandID>99</CandID>
<noteDate>2009-07-06T00:00:00</noteDate>
<note>committee recommends regret ltr (little teaching experience); regret ltr sent 7/14/09 CA.</note>
</tblNotes>
<tblNotes>
<noteID>236</noteID>
<CandID>100</CandID>
<noteDate>2009-07-06T00:00:00</noteDate>
<note>committee recommends regret letter; regret ltr sent 7/14/09 CA.</note>
</tblNotes>
<tblNotes>
<noteID>237</noteID>
<CandID>102</CandID>
<note>CV sent to DTS 7/5 CB.</note>
</tblNotes>
<tblNotes>
<noteID>238</noteID>
<CandID>103</CandID>
<noteDate>2009-08-03T00:00:00</noteDate>
<note>chair to obtain comments from DLP.</note>
</tblNotes>
<tblNotes>
<noteID>239</noteID>
<CandID>104</CandID>
<noteDate>2009-08-17T00:00:00</noteDate>
<note>regret ltr sent.</note>
</tblNotes>
<tblNotes>
<noteID>240</noteID>
<CandID>105</CandID>
<noteDate>2009-10-13T00:00:00</noteDate>
<note>has good skills and teaching exp; not a huge breadth of informatics exp; could be mentored to do what was needed; clinical track likely.  Request that CMJ have informal mtg with candidate and follow up with Ed Hammond re:  candidate; DHB to conduct reference checks;</note>
</tblNotes>
<tblNotes>
<noteID>243</noteID>
<CandID>108</CandID>
<noteDate>2009-11-03T00:00:00</noteDate>
<note>Regret ltr to be sent - sent 11/13/09/</note>
</tblNotes>
<tblNotes>
<noteID>245</noteID>
<CandID>110</CandID>
<noteDate>2009-10-12T00:00:00</noteDate>
<note>CEB to contact candidate for phone interview.</note>
</tblNotes>
<tblNotes>
<noteID>248</noteID>
<CandID>113</CandID>
<note>Per CEB email of 10/21/09 concuring w/TV comments, pass; regret ltr sent 10/22/09.</note>
</tblNotes>
<tblNotes>
<noteID>250</noteID>
<CandID>115</CandID>
<noteDate>2009-10-06T00:00:00</noteDate>
<note>Search committee chair  advised candidate has accepted another position.</note>
</tblNotes>
<tblNotes>
<noteID>253</noteID>
<CandID>118</CandID>
<noteDate>2009-09-04T00:00:00</noteDate>
<note>candidate&apos;s materials forwarded to DTS; no committee action at this ime.</note>
</tblNotes>
<tblNotes>
<noteID>255</noteID>
<CandID>120</CandID>
<noteDate>2009-09-04T00:00:00</noteDate>
<note>materials forwarded to DTS; no committee action at this time.</note>
</tblNotes>
<tblNotes>
<noteID>256</noteID>
<CandID>122</CandID>
<noteDate>2009-10-27T00:00:00</noteDate>
<note>Committee chair noted experiences teaching are unclear (no dates); psych position has filled; regret ltr sent 10/29/09.</note>
</tblNotes>
<tblNotes>
<noteID>257</noteID>
<CandID>123</CandID>
<noteDate>2009-10-27T00:00:00</noteDate>
<note>Committee chair noted candidate&apos;s lack of academic experience and predominant clinic experiences; regret ltr to be sent.  Regret ltr sent 102909</note>
</tblNotes>
<tblNotes>
<noteID>258</noteID>
<CandID>124</CandID>
<noteDate>2009-11-03T00:00:00</noteDate>
<note>Committee recommended regret ltr - regret ltr sent 11/13/09.</note>
</tblNotes>
<tblNotes>
<noteID>259</noteID>
<CandID>125</CandID>
<noteDate>2009-10-12T00:00:00</noteDate>
<note>DLP to finish references; pending this a recommendation for a visit will likely be made; on hold pending outcome of Lisa Day&apos;s recruitment.</note>
</tblNotes>
<tblNotes>
<noteID>260</noteID>
<CandID>126</CandID>
<noteDate>2009-10-12T00:00:00</noteDate>
<note>Comments reviewed and committee recommends a visit.</note>
</tblNotes>
<tblNotes>
<noteID>261</noteID>
<CandID>127</CandID>
<noteDate>2009-10-27T00:00:00</noteDate>
<note>Committee chair noted candidate more experienced in psych rather than gero, and that psych position has been filled; regret ltr to be sent.</note>
</tblNotes>
<tblNotes>
<noteID>262</noteID>
<CandID>128</CandID>
<noteDate>2009-10-27T00:00:00</noteDate>
<note>Committee chair noted MSN not in community health, frequent job changes; interview not recommended;  regret ltr 10/29/09.</note>
</tblNotes>
<tblNotes>
<noteID>263</noteID>
<CandID>129</CandID>
<noteDate>2009-10-12T00:00:00</noteDate>
<note>committee recommends regret ltr.; regret ltr sent 10/20/09.</note>
</tblNotes>
<tblNotes>
<noteID>264</noteID>
<CandID>130</CandID>
<noteDate>2009-10-12T00:00:00</noteDate>
<note>DHB to do phone interview; pending this reference checks will be done.</note>
</tblNotes>
<tblNotes>
<noteID>265</noteID>
<CandID>131</CandID>
<noteDate>2009-10-12T00:00:00</noteDate>
<note>CEB to conduct phone interview with candidate and do ref checks.</note>
</tblNotes>
<tblNotes>
<noteID>270</noteID>
<CandID>138</CandID>
<noteDate>2009-11-03T00:00:00</noteDate>
<note>11/3/09: candidate looks good</note>
</tblNotes>
<tblNotes>
<noteID>272</noteID>
<CandID>131</CandID>
<noteDate>2009-11-03T00:00:00</noteDate>
<note>community involvement is a plus; focus is adolescent health; based on favorable reference checks, committee recommends a campus visit</note>
</tblNotes>
<tblNotes>
<noteID>273</noteID>
<CandID>120</CandID>
<noteDate>2009-10-20T00:00:00</noteDate>
<note>Per CEB email and review, pass due to lack of teaching experience; regret ltr sent with note that candidate&apos;s CV will be forwarded (to D Mattice) for CI consideration. 10/22/2009</note>
</tblNotes>
<tblNotes>
<noteID>274</noteID>
<CandID>118</CandID>
<noteDate>2009-10-27T00:00:00</noteDate>
<note>Committee chair noted candidate&apos;s lack of academic teaching experience; regret ltr to be sent.</note>
</tblNotes>
<tblNotes>
<noteID>275</noteID>
<CandID>104</CandID>
<note>Forward to DTS following committee meeting on 8/3 CB.</note>
</tblNotes>
<tblNotes>
<noteID>276</noteID>
<CandID>103</CandID>
<noteDate>2009-09-02T00:00:00</noteDate>
<note>DLP did not see a fit.</note>
</tblNotes>
<tblNotes>
<noteID>277</noteID>
<CandID>103</CandID>
<noteDate>2009-09-03T00:00:00</noteDate>
<note>Regret ltr sent.</note>
</tblNotes>
<tblNotes>
<noteID>278</noteID>
<CandID>102</CandID>
<noteDate>2009-08-17T00:00:00</noteDate>
<note>Regret ltr sent.</note>
</tblNotes>
<tblNotes>
<noteID>279</noteID>
<CandID>102</CandID>
<noteDate>2009-07-06T00:00:00</noteDate>
<note>DP to convey prior experiences w/candidate to DTS.</note>
</tblNotes>
<tblNotes>
<noteID>280</noteID>
<CandID>96</CandID>
<noteDate>2009-08-03T00:00:00</noteDate>
<note>committee suggested keeping candidate warm pending Carter and Wise visits.  CEB to f/u with candidate; share DUSON tenure track guidelines,  get three current references.</note>
</tblNotes>
<tblNotes>
<noteID>281</noteID>
<CandID>96</CandID>
<noteDate>2009-11-03T00:00:00</noteDate>
<note>may not be sincerely interested in Duke; recommend regret ltr</note>
</tblNotes>
<tblNotes>
<noteID>282</noteID>
<CandID>91</CandID>
<note>Forwarded to Dori 6/16;</note>
</tblNotes>
<tblNotes>
<noteID>283</noteID>
<CandID>90</CandID>
<noteDate>2009-07-06T00:00:00</noteDate>
<note>Committee recommends regret ltr; regret ltr sent 7/14/09 CA.</note>
</tblNotes>
<tblNotes>
<noteID>284</noteID>
<CandID>12</CandID>
<noteDate>2009-02-02T00:00:00</noteDate>
<note>Hold, pending telephone calls with Silva and Tian; CB advised candidate that Duke would be in touch in early spring re:  this recruitment;r</note>
</tblNotes>
<tblNotes>
<noteID>285</noteID>
<CandID>12</CandID>
<noteDate>2009-03-02T00:00:00</noteDate>
<note>More qualified applicants identified;</note>
</tblNotes>
<tblNotes>
<noteID>286</noteID>
<CandID>12</CandID>
<noteDate>2009-03-06T00:00:00</noteDate>
<note>Regret ltr sent.</note>
</tblNotes>
<tblNotes>
<noteID>288</noteID>
<CandID>26</CandID>
<noteDate>2009-01-19T00:00:00</noteDate>
<note>candidate advised CB of withdrawal of application.</note>
</tblNotes>
<tblNotes>
<noteID>289</noteID>
<CandID>39</CandID>
<noteDate>2009-02-05T00:00:00</noteDate>
<note>LLD comments from phone interview:  &quot;applied statistician&quot;; 10yrs @ DCRI - good time for a change - grants ending;  interested in mentoring others in developing a research program;  recommend a visit pending ref checks.</note>
</tblNotes>
<tblNotes>
<noteID>290</noteID>
<CandID>39</CandID>
<noteDate>2009-02-09T00:00:00</noteDate>
<note>Visit recommended/approved; to be schedule for mid-March.  March 17th visit scheduled</note>
</tblNotes>
<tblNotes>
<noteID>291</noteID>
<CandID>39</CandID>
<noteDate>2009-04-13T00:00:00</noteDate>
<note>committee supports hire; dean to interview candidate.</note>
</tblNotes>
<tblNotes>
<noteID>292</noteID>
<CandID>39</CandID>
<noteDate>2009-05-04T00:00:00</noteDate>
<note>offer pending</note>
</tblNotes>
<tblNotes>
<noteID>293</noteID>
<CandID>43</CandID>
<noteDate>2009-02-05T00:00:00</noteDate>
<note>Regret ltr sent 2/5/09.  CLOSED.</note>
</tblNotes>
<tblNotes>
<noteID>294</noteID>
<CandID>44</CandID>
<noteDate>2009-02-05T00:00:00</noteDate>
<note>LLD comments from interview:  Ms. Tian enter, clean and analyze data; runs data for faculty&apos;s studies; has taught primarily SPSS; knows some SAS; has not helped faculty develop or write data analysis.</note>
</tblNotes>
<tblNotes>
<noteID>295</noteID>
<CandID>44</CandID>
<noteDate>2009-04-13T00:00:00</noteDate>
<note>holding pending Silva outcome.</note>
</tblNotes>
<tblNotes>
<noteID>296</noteID>
<CandID>44</CandID>
<noteDate>2009-05-22T00:00:00</noteDate>
<note>regret ltr sent.</note>
</tblNotes>
<tblNotes>
<noteID>297</noteID>
<CandID>46</CandID>
<noteDate>2009-03-06T00:00:00</noteDate>
<note>regret ltr sent</note>
</tblNotes>
<tblNotes>
<noteID>298</noteID>
<CandID>50</CandID>
<noteDate>2009-03-06T00:00:00</noteDate>
<note>CB - Spoke with candidate and encouraged her to update her materials in the fall when she is closer to completion of DNP. Advised that hire date for Peds/ABSN position (expansion) was 1/1/10.</note>
</tblNotes>
<tblNotes>
<noteID>299</noteID>
<CandID>50</CandID>
<noteDate>2009-06-01T00:00:00</noteDate>
<note>candidate will update committee as her capstone project progresses; CB to notify candidate that other potential peds candidates to be interviewed</note>
</tblNotes>
<tblNotes>
<noteID>300</noteID>
<CandID>50</CandID>
<noteDate>2009-08-03T00:00:00</noteDate>
<note>Per chair, candidate will not finish capstone project until summer 2010; as courtesy, it was suggested to advise candidate of other candidates&apos; campus visits - CEB to advise candidate of such.</note>
</tblNotes>
<tblNotes>
<noteID>301</noteID>
<CandID>50</CandID>
<noteDate>2009-11-03T00:00:00</noteDate>
</tblNotes>
<tblNotes>
<noteID>302</noteID>
<CandID>52</CandID>
<noteDate>2009-03-02T00:00:00</noteDate>
<note>send phone interview comments under TV2; send ideas to DP and LLD unless they have thoughts to the contrary, recommend regret ltr/no match.</note>
</tblNotes>
<tblNotes>
<noteID>303</noteID>
<CandID>52</CandID>
<noteDate>2009-03-19T00:00:00</noteDate>
<note>Regret ltr sent</note>
</tblNotes>
<tblNotes>
<noteID>304</noteID>
<CandID>89</CandID>
<noteDate>2009-09-17T00:00:00</noteDate>
<note>Regret ltr sent</note>
</tblNotes>
<tblNotes>
<noteID>305</noteID>
<CandID>69</CandID>
<noteDate>2009-04-17T00:00:00</noteDate>
<note>ltr sent 4/17/09</note>
</tblNotes>
<tblNotes>
<noteID>306</noteID>
<CandID>68</CandID>
<noteDate>2009-04-17T00:00:00</noteDate>
<note>ltr sent 4/17/09</note>
</tblNotes>
<tblNotes>
<noteID>307</noteID>
<CandID>78</CandID>
<noteDate>2009-04-17T00:00:00</noteDate>
<note>ltr sent 4/17/09</note>
</tblNotes>
<tblNotes>
<noteID>308</noteID>
<CandID>79</CandID>
<noteDate>2009-04-17T00:00:00</noteDate>
<note>ltr sent 4/17/09.</note>
</tblNotes>
<tblNotes>
<noteID>309</noteID>
<CandID>86</CandID>
<noteDate>2009-06-08T00:00:00</noteDate>
<note>regret ltr sent 6/8/09</note>
</tblNotes>
<tblNotes>
<noteID>310</noteID>
<CandID>80</CandID>
<noteDate>2009-06-08T00:00:00</noteDate>
<note>regret ltr sent 6/08/09.</note>
</tblNotes>
<tblNotes>
<noteID>311</noteID>
<CandID>53</CandID>
<noteDate>2009-02-06T00:00:00</noteDate>
<note>2/6/09:  DP comments from TC:  good potential/ drive to become a solid, productive educator/researcher; would require mentoring. I would not recommend Ms. Carthron for an interview or follow up. I think she has good potential and drive to become a solid and productive educator and researcher. However, I do not think we have the human resources  to provide for her the mentoring she has missed and that which she will continue to need. It would be a disservice to provide less. It is most unfortunate, that her doctoral studies will not culminate in producing the outcome attributes that will enable her to go smoothly  to the next step in her career without a level of coaching few will be willing to give.  CB to discuss w/AMcB.</note>
</tblNotes>
<tblNotes>
<noteID>312</noteID>
<CandID>53</CandID>
<noteDate>2009-04-13T00:00:00</noteDate>
<note>FYI candidate successfully defended dissertation this month.</note>
</tblNotes>
<tblNotes>
<noteID>313</noteID>
<CandID>53</CandID>
<noteDate>2009-06-01T00:00:00</noteDate>
<note>per mtg w/search comm chair, accepted a position with WSSU.</note>
</tblNotes>
<tblNotes>
<noteID>314</noteID>
<CandID>88</CandID>
<noteDate>2009-06-01T00:00:00</noteDate>
<note>Committee recommended M Relf speak to candidate re:  needs in ABSN program and timing of hiring for position; CB to update MR on candidate</note>
</tblNotes>
<tblNotes>
<noteID>315</noteID>
<CandID>88</CandID>
<noteDate>2009-07-06T00:00:00</noteDate>
<note>MVR had phone interview and suggests interviewing candidate; DB will contact BW to get and check references; pending references, campus visit recommended; visit scheduled for 09/10/09</note>
</tblNotes>
<tblNotes>
<noteID>316</noteID>
<CandID>54</CandID>
<noteDate>2009-03-02T00:00:00</noteDate>
<note>From CEB phone interview:  candidate is happy at UTHS; likes to &quot; start things up&quot;; teaches only informatics (masters and PhD); has a reputation for concepts and methods;  candidate to provide references and CEB will check references.</note>
</tblNotes>
<tblNotes>
<noteID>317</noteID>
<CandID>54</CandID>
<noteDate>2009-04-13T00:00:00</noteDate>
<note>recommend visit</note>
</tblNotes>
<tblNotes>
<noteID>318</noteID>
<CandID>54</CandID>
<noteDate>2009-07-06T00:00:00</noteDate>
<note>committee suggests regret ltr; evals not overwhelmingly supportive</note>
</tblNotes>
<tblNotes>
<noteID>319</noteID>
<CandID>54</CandID>
<noteDate>2009-07-13T00:00:00</noteDate>
<note>7/13. Spoke with candidate and told him we would not be continuing his candidacy. He said if he could be of help to DUSON in the future to let him know. CB</note>
</tblNotes>
<tblNotes>
<noteID>320</noteID>
<CandID>54</CandID>
<noteDate>2009-07-13T00:00:00</noteDate>
<note>Regret ltr sent. CA</note>
</tblNotes>
<tblNotes>
<noteID>321</noteID>
<CandID>57</CandID>
<noteDate>2009-02-02T00:00:00</noteDate>
<note>2/2:  DB contacted 2 of 4 references; very positive responses; DB to finish this week and update database and committee via email.</note>
</tblNotes>
<tblNotes>
<noteID>322</noteID>
<CandID>57</CandID>
<noteDate>2009-03-06T00:00:00</noteDate>
<note>3/6/09:  DEB spoke with candidate; indicated we are currenlty reevaluating faculty needs, hiring is slowing and that focus is on ABSN positions; DEB will be back in touch when it becames clear how position will unfold; candidate was advised she that was still active.</note>
</tblNotes>
<tblNotes>
<noteID>323</noteID>
<CandID>57</CandID>
<noteDate>2009-07-06T00:00:00</noteDate>
<note>7/6/09: committee recommends campus visit, in light of Turley outcome</note>
</tblNotes>
<tblNotes>
<noteID>324</noteID>
<CandID>57</CandID>
<noteDate>2009-07-07T00:00:00</noteDate>
<note>7/7/09:  Chair contacted candidate and candidated advised that she had accepted a two year fellowship at UNC.</note>
</tblNotes>
<tblNotes>
<noteID>329</noteID>
<CandID>62</CandID>
<noteDate>2009-05-22T00:00:00</noteDate>
<note>5/22/09:  Regret ltr sent.</note>
</tblNotes>
<tblNotes>
<noteID>330</noteID>
<CandID>63</CandID>
<noteDate>2009-04-13T00:00:00</noteDate>
<note>4/13/09:  confirm w/dean $$ for OGACHI position and recommend campus visit.</note>
</tblNotes>
<tblNotes>
<noteID>331</noteID>
<CandID>63</CandID>
<noteDate>2009-06-01T00:00:00</noteDate>
<note>6/1/09:  based on evaluations, committee does not recommend further recruitment; CB to advise dean;</note>
</tblNotes>
<tblNotes>
<noteID>332</noteID>
<CandID>63</CandID>
<noteDate>2009-06-08T00:00:00</noteDate>
<note>regret ltr sent 060809</note>
</tblNotes>
<tblNotes>
<noteID>333</noteID>
<CandID>64</CandID>
<noteDate>2009-04-13T00:00:00</noteDate>
<note>4/13/09:  continue to pursue candidate; DHB to conduct reference check and advise candidate of the same.</note>
</tblNotes>
<tblNotes>
<noteID>334</noteID>
<CandID>64</CandID>
<noteDate>2009-05-04T00:00:00</noteDate>
<note>5/4/09:  DHB will f/u with references and will obtain additional names from candidate;</note>
</tblNotes>
<tblNotes>
<noteID>335</noteID>
<CandID>64</CandID>
<noteDate>2009-06-01T00:00:00</noteDate>
<note>6/1/09:  based on unsupportive references, committee to recommend regret ltr;</note>
</tblNotes>
<tblNotes>
<noteID>336</noteID>
<CandID>64</CandID>
<noteDate>2009-06-08T00:00:00</noteDate>
<note>regret ltr sent 6/8/09</note>
</tblNotes>
<tblNotes>
<noteID>337</noteID>
<CandID>66</CandID>
<noteDate>2009-04-13T00:00:00</noteDate>
<note>4/13/09. I hope to meet with him and Dr. Berry early May at ONS.
4/13/09;  candidate will be back in touch upon completion of dissertation.</note>
</tblNotes>
<tblNotes>
<noteID>338</noteID>
<CandID>66</CandID>
<noteDate>2009-05-04T00:00:00</noteDate>
<note>5/4/09:  CB met w/Dr. Berry and Tariman. 5/18. Mr Tariman informed me that his NRSA has been funded and his timeline has moved to June 2010.</note>
</tblNotes>
<tblNotes>
<noteID>339</noteID>
<CandID>67</CandID>
<noteDate>2009-05-04T00:00:00</noteDate>
<note>5/4/09:  CB to be in DTS/BT re:  communication and next steps w/candidate</note>
</tblNotes>
<tblNotes>
<noteID>340</noteID>
<CandID>67</CandID>
<noteDate>2009-06-16T00:00:00</noteDate>
<note>6/16/09:  on recommendation of B. Trey, regret ltr sent.</note>
</tblNotes>
<tblNotes>
<noteID>341</noteID>
<CandID>70</CandID>
<noteDate>2009-04-30T00:00:00</noteDate>
<note>4/30/09: Notes on telephone interview attached under comments. D. Powell</note>
</tblNotes>
<tblNotes>
<noteID>342</noteID>
<CandID>70</CandID>
<noteDate>2009-05-04T00:00:00</noteDate>
<note>5/4/09:  CB to ask DP to conduct reference checks</note>
</tblNotes>
<tblNotes>
<noteID>343</noteID>
<CandID>70</CandID>
<noteDate>2009-06-01T00:00:00</noteDate>
<note>6/1/09:  CB/DP to add references to database; committee to recommend a visit</note>
</tblNotes>
<tblNotes>
<noteID>344</noteID>
<CandID>70</CandID>
<noteDate>2009-06-07T00:00:00</noteDate>
<note>7/6/09:  recommendation to dean supporting recruitment</note>
</tblNotes>
<tblNotes>
<noteID>345</noteID>
<CandID>87</CandID>
<noteDate>2009-08-17T00:00:00</noteDate>
<note>8/17/09:  Regret ltr sent.</note>
</tblNotes>
<tblNotes>
<noteID>346</noteID>
<CandID>84</CandID>
<noteDate>2009-05-08T00:00:00</noteDate>
<note>5/8/09: Terry will conduct phone screen</note>
</tblNotes>
<tblNotes>
<noteID>347</noteID>
<CandID>84</CandID>
<noteDate>2009-05-27T00:00:00</noteDate>
<note>5/27: Candidiate withdrew due to upcoming marriage of daughter.</note>
</tblNotes>
<tblNotes>
<noteID>348</noteID>
<CandID>84</CandID>
<noteDate>2009-05-31T00:00:00</noteDate>
<note>5/31.seems no need for DP to review.</note>
</tblNotes>
<tblNotes>
<noteID>349</noteID>
<CandID>84</CandID>
<noteDate>2009-10-27T00:00:00</noteDate>
<note>10/27/09: Candidate resubmitted application materials to be considered for an ABSN faculty position.</note>
</tblNotes>
<tblNotes>
<noteID>350</noteID>
<CandID>83</CandID>
<noteDate>2009-05-08T00:00:00</noteDate>
<note>5/08/09: PASS</note>
</tblNotes>
<tblNotes>
<noteID>351</noteID>
<CandID>83</CandID>
<noteDate>2009-06-01T00:00:00</noteDate>
<note>6/1/09: regret ltr to be sent;</note>
</tblNotes>
<tblNotes>
<noteID>352</noteID>
<CandID>83</CandID>
<noteDate>2009-06-08T00:00:00</noteDate>
<note>regret ltr sent 
6/8/09</note>
</tblNotes>
<tblNotes>
<noteID>353</noteID>
<CandID>82</CandID>
<noteDate>2009-06-01T00:00:00</noteDate>
<note>6/1/09:  revisit in light of two closed candidate; CB to call candidate &amp;  ask candidate to resubmit materials for ABSN program position.</note>
</tblNotes>
<tblNotes>
<noteID>354</noteID>
<CandID>82</CandID>
<noteDate>2009-06-02T00:00:00</noteDate>
<note>6/2. Spoke with candidate and she will submit new letter expressing interest in ABSN. See letter dated 6/5</note>
</tblNotes>
<tblNotes>
<noteID>355</noteID>
<CandID>82</CandID>
<noteDate>2009-07-06T00:00:00</noteDate>
<note>7/6/09:  Committee suggests regret ltr; regret ltr sent 7/14/09 CA.</note>
</tblNotes>
<tblNotes>
<noteID>356</noteID>
<CandID>82</CandID>
<noteDate>2009-07-14T00:00:00</noteDate>
<note>regret ltr sent 7/14/09 CA.</note>
</tblNotes>
<tblNotes>
<noteID>357</noteID>
<CandID>77</CandID>
<noteDate>2009-05-04T00:00:00</noteDate>
<note>5/4/09:  CB to check on ltr of interest from BG</note>
</tblNotes>
<tblNotes>
<noteID>358</noteID>
<CandID>77</CandID>
<noteDate>2009-06-01T00:00:00</noteDate>
<note>6/1/09:  CB to ask LLD to ask BG for ltr and references (DP or LLD to do reference check)</note>
</tblNotes>
<tblNotes>
<noteID>359</noteID>
<CandID>77</CandID>
<noteDate>2009-08-03T00:00:00</noteDate>
<note>8/3/09:  committee recommends pursuing candidate for a full time faculty position; acknowledges concerns re:  FT faculty responsibilities; CEB to f/u with DLP prior to forwarding receommendation; recommendation to continue recruitment forwarded to dean.</note>
</tblNotes>
<tblNotes>
<noteID>363</noteID>
<CandID>75</CandID>
<noteDate>2009-04-17T00:00:00</noteDate>
<note>ltr sent 4/17/09.</note>
</tblNotes>
<tblNotes>
<noteID>364</noteID>
<CandID>75</CandID>
<noteDate>2009-10-06T00:00:00</noteDate>
<note>10/6/09:  Candidate resubmitted materials for informatics faculty position consideration</note>
</tblNotes>
<tblNotes>
<noteID>365</noteID>
<CandID>75</CandID>
<noteDate>2009-10-27T00:00:00</noteDate>
<note>10/27/09:  Committee chair noted no relevant experiences to informatics position; regret ltr to be sent.</note>
</tblNotes>
<tblNotes>
<noteID>366</noteID>
<CandID>74</CandID>
<noteDate>2009-04-13T00:00:00</noteDate>
<note>4/13/09:  recommend regret ltr (no match at this time).  CEB to call candidate. Email sent on 7/26 to set up phone call, and had no reply.</note>
</tblNotes>
<tblNotes>
<noteID>368</noteID>
<CandID>72</CandID>
<noteDate>2009-06-16T00:00:00</noteDate>
<note>6/16/09: on recommendation of B. Trey regret ltr sent (candidate exploring other opportunties).</note>
</tblNotes>
<tblNotes>
<noteID>369</noteID>
<CandID>71</CandID>
<noteDate>2009-03-23T00:00:00</noteDate>
<note>3/23/09:  per email from candidate:  would also like to be considered for researcher faculty position.</note>
</tblNotes>
<tblNotes>
<noteID>370</noteID>
<CandID>71</CandID>
<noteDate>2009-04-13T00:00:00</noteDate>
<note>4/13/09:  chair to consult with DHD and f/u re:  Woods visit; not a fit for newly posted researcher position.</note>
</tblNotes>
<tblNotes>
<noteID>371</noteID>
<CandID>71</CandID>
<noteDate>2009-05-04T00:00:00</noteDate>
<note>5/4/09:  pending LLD and DP comments, regret ltr;</note>
</tblNotes>
<tblNotes>
<noteID>372</noteID>
<CandID>71</CandID>
<noteDate>2009-05-08T00:00:00</noteDate>
<note>regret ltr sent 5/8/09</note>
</tblNotes>
<tblNotes>
<noteID>376</noteID>
<CandID>132</CandID>
<noteDate>2009-11-03T00:00:00</noteDate>
<note>Committee recommended regret letter; ltr sent 11/13/09</note>
</tblNotes>
<tblNotes>
<noteID>377</noteID>
<CandID>84</CandID>
<noteDate>2009-11-13T00:00:00</noteDate>
<note>Committee recommends a regret ltr; ltr prepared 11/13/09; per chair, hold regret ltr.</note>
</tblNotes>
<tblNotes>
<noteID>378</noteID>
<CandID>139</CandID>
<noteDate>2009-11-03T00:00:00</noteDate>
<note>Committee recommends regret ltr; regret ltr sent 11/13/09</note>
</tblNotes>
<tblNotes>
<noteID>379</noteID>
<CandID>135</CandID>
<noteDate>2009-11-03T00:00:00</noteDate>
<note>Committee recommends regret ltr; regret ltr sent 11/13/09</note>
</tblNotes>
<tblNotes>
<noteID>381</noteID>
<CandID>145</CandID>
<noteDate>2009-12-18T00:00:00</noteDate>
<note>Per chair&apos;s review, regret ltr sent 12/28/09.  CONFIDENTIAL APPLICANT</note>
</tblNotes>
<tblNotes>
<noteID>382</noteID>
<CandID>88</CandID>
<noteDate>2009-11-19T00:00:00</noteDate>
<note>Chair informed candidate of decision re:  ABSN position and potential new acute care spec dir position posting; candidate expressed interest.</note>
</tblNotes>
<tblNotes>
<noteID>384</noteID>
<CandID>126</CandID>
<noteDate>2009-12-08T00:00:00</noteDate>
<note>Committee recommends to not pursue continued recruitment in light of reviews.</note>
</tblNotes>
<tblNotes>
<noteID>385</noteID>
<CandID>131</CandID>
<noteDate>2009-12-08T00:00:00</noteDate>
<note>Committee recommends continuing recruitment.</note>
</tblNotes>
<tblNotes>
<noteID>386</noteID>
<CandID>50</CandID>
<noteDate>2009-12-08T00:00:00</noteDate>
<note>Candidate could be hired upon completion of degree; hold</note>
</tblNotes>
<tblNotes>
<noteID>387</noteID>
<CandID>130</CandID>
<noteDate>2009-12-21T00:00:00</noteDate>
<note>Originally applicant for an unspecified faculty position; DHB advised candidate of suitability for AC/PNP position; candidate forwarded ltr of interest for AC/PNP position.</note>
</tblNotes>
<tblNotes>
<noteID>388</noteID>
<CandID>150</CandID>
<noteDate>2009-12-08T00:00:00</noteDate>
<note>DHB to do a phone screen with candidate and contact references and will email committee to confirm a recommendation for a visit.</note>
</tblNotes>
<tblNotes>
<noteID>389</noteID>
<CandID>138</CandID>
<noteDate>2009-12-08T00:00:00</noteDate>
<note>CEB to conduct initial phone screen and possibly do reference check.; 1/4/09 Chip to conduct reference checks; pending favorable reference checks, committee could recommend a visit</note>
</tblNotes>
<tblNotes>
<noteID>390</noteID>
<CandID>141</CandID>
<noteDate>2009-12-08T00:00:00</noteDate>
<note>Candidate to receive regret letter; regret ltr sent 12/11/2009</note>
</tblNotes>
<tblNotes>
<noteID>391</noteID>
<CandID>144</CandID>
<noteDate>2009-12-08T00:00:00</noteDate>
<note>CEB to speak to candidate regarding lack of fit; will send a regret letter</note>
</tblNotes>
<tblNotes>
<noteID>392</noteID>
<CandID>136</CandID>
<noteDate>2009-12-08T00:00:00</noteDate>
<note>LLD to do phone screen.</note>
</tblNotes>
<tblNotes>
<noteID>393</noteID>
<CandID>105</CandID>
<noteDate>2009-12-08T00:00:00</noteDate>
<note>Regret letter to be sent; ltr sent 12/11/09.</note>
</tblNotes>
<tblNotes>
<noteID>394</noteID>
<CandID>110</CandID>
<noteDate>2009-12-08T00:00:00</noteDate>
<note>Regret ltr to be sent; regret ltr sent 12/11/2009.</note>
</tblNotes>
<tblNotes>
<noteID>395</noteID>
<CandID>84</CandID>
<noteDate>2009-12-08T00:00:00</noteDate>
<note>Regret ltr to be sent; ltr sent 12/11/09</note>
</tblNotes>
<tblNotes>
<noteID>396</noteID>
<CandID>125</CandID>
<noteDate>2009-12-08T00:00:00</noteDate>
<note>CLG advised to contact candidate to verify that candidate&apos;s goals match ABSN goals re:  community teach; DLP and MV to coordinate a call to candidate to discuss her goals; MVR spoke to candidate on 12/15 and clarified expectations of ABSN program and was positive about conversation which he communicated to chair; chair communicated this to dean; visit to be scheduled in Feb 2010</note>
</tblNotes>
<tblNotes>
<noteID>397</noteID>
<CandID>92</CandID>
<noteDate>2009-12-08T00:00:00</noteDate>
<note>Regret letter to be sent; regret ltr sent 12/11/2009</note>
</tblNotes>
<tblNotes>
<noteID>398</noteID>
<CandID>74</CandID>
<noteDate>2009-12-08T00:00:00</noteDate>
<note>CEB to phone candidate to close file; did not respond to email to schedule phone call; file will be closed.</note>
</tblNotes>
<tblNotes>
<noteID>399</noteID>
<CandID>111</CandID>
<noteDate>2009-12-08T00:00:00</noteDate>
<note>Regret ltr to be sent; ltr 12/11/2009; see C. Johnson&apos;s review/comments</note>
</tblNotes>
<tblNotes>
<noteID>400</noteID>
<CandID>107</CandID>
<noteDate>2009-12-08T00:00:00</noteDate>
<note>Regret sent 12/14/09; see C. Johnson&apos;s review/comments</note>
</tblNotes>
<tblNotes>
<noteID>401</noteID>
<CandID>114</CandID>
<noteDate>2009-12-08T00:00:00</noteDate>
<note>Regret ltr to be sent; see C. Johnson comments</note>
</tblNotes>
<tblNotes>
<noteID>402</noteID>
<CandID>112</CandID>
<noteDate>2009-12-08T00:00:00</noteDate>
<note>Regret ltr sent 12/11/2009</note>
</tblNotes>
<tblNotes>
<noteID>403</noteID>
<CandID>147</CandID>
<noteDate>2009-12-02T00:00:00</noteDate>
<note>Application acknowledged and forwarded to B. Trey for review/action</note>
</tblNotes>
<tblNotes>
<noteID>404</noteID>
<CandID>126</CandID>
<noteDate>2009-12-16T00:00:00</noteDate>
<note>Chair contacted candidate to advise that the school would not be continuing her recruitment; regret ltr sent 12/18/2009</note>
</tblNotes>
<tblNotes>
<noteID>405</noteID>
<CandID>136</CandID>
<noteDate>2009-12-18T00:00:00</noteDate>
<note>Candidate withdrew from consideration due to timing of a a potential move/possibly restarting tenure clock w/in SON (see email of 12/17/09 in comments section).</note>
</tblNotes>
<tblNotes>
<noteID>406</noteID>
<CandID>106</CandID>
<noteDate>2009-12-18T00:00:00</noteDate>
<note>Regret ltr sent 12/28/09, per chair&apos;s review.</note>
</tblNotes>
<tblNotes>
<noteID>407</noteID>
<CandID>140</CandID>
<noteDate>2009-12-18T00:00:00</noteDate>
<note>Per chair, regret ltr sent 12/28/09</note>
</tblNotes>
<tblNotes>
<noteID>408</noteID>
<CandID>148</CandID>
<noteDate>2009-12-18T00:00:00</noteDate>
<note>Per chair&apos;s review, regret ltr sent 12/28</note>
</tblNotes>
<tblNotes>
<noteID>409</noteID>
<CandID>143</CandID>
<noteDate>2009-12-18T00:00:00</noteDate>
<note>Per chair&apos;s review, regret ltr sent 12/28/09</note>
</tblNotes>
<tblNotes>
<noteID>410</noteID>
<CandID>146</CandID>
<noteDate>2009-12-18T00:00:00</noteDate>
<note>Per chair&apos;s review, regret ltr sent 12/28/09</note>
</tblNotes>
<tblNotes>
<noteID>411</noteID>
<CandID>109</CandID>
<noteDate>2009-12-18T00:00:00</noteDate>
<note>Per discussion w/chair, regret ltr sent 12/28/2009</note>
</tblNotes>
<tblNotes>
<noteID>412</noteID>
<CandID>157</CandID>
<noteDate>2010-01-04T00:00:00</noteDate>
<note>Committee recommends chair have 1:1 conversation with candidate to determine specific intent/desires; DLP to contact re: upcoming OGACHi project</note>
</tblNotes>
<tblNotes>
<noteID>413</noteID>
<CandID>159</CandID>
<noteDate>2010-01-04T00:00:00</noteDate>
<note>Hold - pending other peds acute candidates</note>
</tblNotes>
<tblNotes>
<noteID>414</noteID>
<CandID>150</CandID>
<noteDate>2010-01-04T00:00:00</noteDate>
<note>Committee recommends a campus visit.</note>
</tblNotes>
<tblNotes>
<noteID>415</noteID>
<CandID>130</CandID>
<noteDate>2010-01-04T00:00:00</noteDate>
<note>Committee recommends a campus visit.</note>
</tblNotes>
<tblNotes>
<noteID>416</noteID>
<CandID>161</CandID>
<noteDate>2010-01-04T00:00:00</noteDate>
<note>Chip to do phone screen and reference checks.</note>
</tblNotes>
<tblNotes>
<noteID>417</noteID>
<CandID>149</CandID>
<noteDate>2009-01-04T00:00:00</noteDate>
<note>Committee recommends regret ltr; ltr sent 1/6/09</note>
</tblNotes>
<tblNotes>
<noteID>418</noteID>
<CandID>151</CandID>
<noteDate>2010-01-04T00:00:00</noteDate>
<note>Committee recommends regret ltr; ltr sent 1/6/10</note>
</tblNotes>
<tblNotes>
<noteID>419</noteID>
<CandID>154</CandID>
<noteDate>2010-01-04T00:00:00</noteDate>
<note>Committee recommends regret ltr; ltr sent 1/6/2010</note>
</tblNotes>
<tblNotes>
<noteID>420</noteID>
<CandID>142</CandID>
<noteDate>2010-01-04T00:00:00</noteDate>
<note>Committee recommends regret ltr; ltr sent 1/6/10</note>
</tblNotes>
<tblNotes>
<noteID>421</noteID>
<CandID>153</CandID>
<noteDate>2010-01-04T00:00:00</noteDate>
<note>Committee recommends regret ltr; ltr sent 1/6/10</note>
</tblNotes>
<tblNotes>
<noteID>422</noteID>
<CandID>156</CandID>
<noteDate>2010-01-04T00:00:00</noteDate>
<note>Committee recommends regret ltr; ltr sent 1/6/10</note>
</tblNotes>
<tblNotes>
<noteID>423</noteID>
<CandID>136</CandID>
</tblNotes>
<tblNotes>
<noteID>424</noteID>
<CandID>155</CandID>
<noteDate>2010-01-04T00:00:00</noteDate>
<note>Committee recommends regret ltr; ltr sent 1/6/10</note>
</tblNotes>
<tblNotes>
<noteID>425</noteID>
<CandID>136</CandID>
<noteDate>2010-01-07T00:00:00</noteDate>
<note>Linda L Davis/NurseSch/mc/Duke 
01/06/2010 06:17 PM	
To	Chip Bailey/NurseSch/mc/Duke, brand005@mc.duke.edu, powel094@mc.duke.edu, Crystal C Arthur/NurseSch/mc/Duke, terry.valiga@duke.edu
cc	
Subject	Michael Furukawa (informatics) 
has advised me that his family does not wish to leave Arizona at this time and so he is choosing to stay put at ASU for the time being. Crystal, we can close this one. LLD</note>
</tblNotes>
<tblNotes>
<noteID>426</noteID>
<CandID>57</CandID>
<noteDate>2010-01-08T00:00:00</noteDate>
<note>Candidate submitted materials for INFORMATICS position; contact information updated</note>
</tblNotes>
<tblNotes>
<noteID>427</noteID>
<CandID>88</CandID>
<noteDate>2010-01-07T00:00:00</noteDate>
<note>Candidate submitted updated CV and cover ltr in consideration for AC PNP/spec dir position.</note>
</tblNotes>
<tblNotes>
<noteID>428</noteID>
<CandID>166</CandID>
<noteDate>2010-01-14T00:00:00</noteDate>
<note>Confidential candidate</note>
</tblNotes>
<tblNotes>
<noteID>429</noteID>
<CandID>164</CandID>
<note>Confidential candidate</note>
</tblNotes>
<tblNotes>
<noteID>430</noteID>
<CandID>165</CandID>
<noteDate>2010-02-01T00:00:00</noteDate>
<note>DLP to call candidate and contact J. Dungan to prep for call; CEB and TV to forward suggested/relevant ?s to DLP</note>
</tblNotes>
<tblNotes>
<noteID>431</noteID>
<CandID>162</CandID>
<noteDate>2010-02-01T00:00:00</noteDate>
<note>LLD to call candidate re: possible recruit doctoral program. Hold sending regret ltr until LLD&apos;s call; regret ltr sent 2/12/10</note>
</tblNotes>
<tblNotes>
<noteID>432</noteID>
<CandID>164</CandID>
<noteDate>2010-02-01T00:00:00</noteDate>
<note>Committee recommends regret ltr; regret ltr sent 2/8/10 and candidate notified of peds opportunity at VCU per committee chair</note>
</tblNotes>
<tblNotes>
<noteID>433</noteID>
<CandID>158</CandID>
<noteDate>2010-02-01T00:00:00</noteDate>
<note>Committee recommends regret ltr; regret ltr sent 2/8/10</note>
</tblNotes>
<tblNotes>
<noteID>434</noteID>
<CandID>167</CandID>
<noteDate>2010-02-01T00:00:00</noteDate>
<note>Committee recommends a regret ltr; regret ltr sent 2/8/10</note>
</tblNotes>
<tblNotes>
<noteID>435</noteID>
<CandID>166</CandID>
<noteDate>2010-02-01T00:00:00</noteDate>
<note>DHB will contact candidate to get references and LLD to conduct reference checks</note>
</tblNotes>
<tblNotes>
<noteID>437</noteID>
<CandID>130</CandID>
<noteDate>2010-02-01T00:00:00</noteDate>
<note>DHB  to email  candidate re:  patience in light of number of candidates (next steps pending K Reuter-Rice visit)</note>
</tblNotes>
<tblNotes>
<noteID>438</noteID>
<CandID>88</CandID>
<noteDate>2010-02-01T00:00:00</noteDate>
<note>DHB  to email  candidate re:  patience in light of number of candidates (next steps pending K Reuter-Rice visit)</note>
</tblNotes>
<tblNotes>
<noteID>439</noteID>
<CandID>159</CandID>
<noteDate>2010-02-01T00:00:00</noteDate>
<note>DHB  to email  candidate re:  patience in light of number of candidates (next steps pending K Reuter-Rice)</note>
</tblNotes>
<tblNotes>
<noteID>440</noteID>
<CandID>50</CandID>
<noteDate>2010-02-01T00:00:00</noteDate>
<note>DHB  to email  candidate to ask for patience in light of number of candidates (pending K Reuter-Rice)</note>
</tblNotes>
<tblNotes>
<noteID>441</noteID>
<CandID>161</CandID>
<noteDate>2010-02-01T00:00:00</noteDate>
<note>Committee to request a candidate visit; candidate visit planned for March</note>
</tblNotes>
<tblNotes>
<noteID>442</noteID>
<CandID>133</CandID>
<noteDate>2010-02-01T00:00:00</noteDate>
<note>following candidate&apos;s conversation w/DTS, candidate intends to withdraw name; committee awaits withdrawal letter; file closed - position filled</note>
</tblNotes>
<tblNotes>
<noteID>443</noteID>
<CandID>169</CandID>
<noteDate>2010-02-01T00:00:00</noteDate>
<note>Committee recommends regret ltr; regret ltr sent 2/8/10</note>
</tblNotes>
<tblNotes>
<noteID>444</noteID>
<CandID>168</CandID>
<noteDate>2010-02-01T00:00:00</noteDate>
<note>Committee recommends regret ltr; regret ltr sent 2/8/10</note>
</tblNotes>
<tblNotes>
<noteID>445</noteID>
<CandID>165</CandID>
<noteDate>2010-02-10T00:00:00</noteDate>
<note>DLP posted comments from TC with candidate; upon review of comments and recommendation,  committee concurred candidate to receive a regret ltr; ltr sent 2/11/2010</note>
</tblNotes>
<tblNotes>
<noteID>446</noteID>
<CandID>170</CandID>
<note>CONFIDENTIAL CANDIDATE; Application forwarded to B. Trey</note>
</tblNotes>
<tblNotes>
<noteID>447</noteID>
<CandID>180</CandID>
<noteDate>2010-02-19T00:00:00</noteDate>
<note>Unable to open candidate&apos;s CV attachment; candidate asked to resend.</note>
</tblNotes>
<tblNotes>
<noteID>448</noteID>
<CandID>138</CandID>
</tblNotes>
<tblNotes>
<noteID>449</noteID>
<CandID>150</CandID>
<noteDate>2010-03-01T00:00:00</noteDate>
<note>DHB to forward recommentation to dean to continuing recruitment, pending input from ADAA</note>
</tblNotes>
<tblNotes>
<noteID>450</noteID>
<CandID>138</CandID>
<noteDate>2010-03-01T00:00:00</noteDate>
<note>DHB to call candidate to inform that candidacy will not be continued; regret ltr to be sent. DHB spoke to candidate on 3/16; regret ltr sent 3/17</note>
</tblNotes>
<tblNotes>
<noteID>451</noteID>
<CandID>116</CandID>
<noteDate>2010-03-01T00:00:00</noteDate>
<note>DHB to forward recommendation to dean to continue recruitment</note>
</tblNotes>
<tblNotes>
<noteID>452</noteID>
<CandID>171</CandID>
<noteDate>2010-03-01T00:00:00</noteDate>
<note>Committee recommends regret ltr; ltr sent 3/3/10</note>
</tblNotes>
<tblNotes>
<noteID>453</noteID>
<CandID>177</CandID>
<noteDate>2010-03-01T00:00:00</noteDate>
<note>Committee recommends regret ltr; ltr sent 030310</note>
</tblNotes>
<tblNotes>
<noteID>454</noteID>
<CandID>175</CandID>
<noteDate>2010-03-01T00:00:00</noteDate>
<note>CEB to call candidate to clarify her work</note>
</tblNotes>
<tblNotes>
<noteID>455</noteID>
<CandID>184</CandID>
<noteDate>2010-03-01T00:00:00</noteDate>
<note>DHB to contact dean to get clarity on HSR position; may engage DT, KC, BT</note>
</tblNotes>
<tblNotes>
<noteID>456</noteID>
<CandID>173</CandID>
<noteDate>2010-03-01T00:00:00</noteDate>
<note>DHB to contact dean to get clarity on HSR position; may engage DT, KC, BT</note>
</tblNotes>
<tblNotes>
<noteID>457</noteID>
<CandID>186</CandID>
<noteDate>2010-03-01T00:00:00</noteDate>
<note>DHB to contact dean to get clarity on HSR position; may engage DT, KC, BT</note>
</tblNotes>
<tblNotes>
<noteID>458</noteID>
<CandID>189</CandID>
<noteDate>2010-03-01T00:00:00</noteDate>
<note>DHB to contact dean to get clarity on HSR position; may engage DT, KC, BT; CV also sent to C Johnson to review for informatics</note>
</tblNotes>
<tblNotes>
<noteID>459</noteID>
<CandID>187</CandID>
<noteDate>2010-03-01T00:00:00</noteDate>
<note>DHB to contact dean to get clarity on HSR position; may engage DT, KC, BT</note>
</tblNotes>
<tblNotes>
<noteID>460</noteID>
<CandID>172</CandID>
<noteDate>2010-03-01T00:00:00</noteDate>
<note>DHB to contact dean to get clarity on HSR position; may engage DT, KC, BT</note>
</tblNotes>
<tblNotes>
<noteID>461</noteID>
<CandID>179</CandID>
<noteDate>2010-03-01T00:00:00</noteDate>
<note>Committee recommends regret ltr; ltr sent 03/03/2010</note>
</tblNotes>
<tblNotes>
<noteID>462</noteID>
<CandID>185</CandID>
<noteDate>2010-03-01T00:00:00</noteDate>
<note>Committee recommends regret ltr; regret ltr sent 03032010</note>
</tblNotes>
<tblNotes>
<noteID>463</noteID>
<CandID>180</CandID>
<noteDate>2010-03-01T00:00:00</noteDate>
<note>Committee recommends regret ltr; ltr sent 03042010</note>
</tblNotes>
<tblNotes>
<noteID>464</noteID>
<CandID>181</CandID>
<noteDate>2010-03-01T00:00:00</noteDate>
<note>Candidate has good potential; DLP to call candidate; hold regret ltr until DLP calls; summary of DLP&apos;s call in comments; regret ltr sent 3/4/10</note>
</tblNotes>
<tblNotes>
<noteID>465</noteID>
<CandID>178</CandID>
<noteDate>2010-03-01T00:00:00</noteDate>
<note>CEB to call candidate to determine practice</note>
</tblNotes>
<tblNotes>
<noteID>466</noteID>
<CandID>176</CandID>
<noteDate>2010-03-01T00:00:00</noteDate>
<note>A good candidate; CEB to call canddiate</note>
</tblNotes>
<tblNotes>
<noteID>467</noteID>
<CandID>183</CandID>
<noteDate>2010-03-01T00:00:00</noteDate>
<note>LLD to call candidate to get a sense of interests and teaching</note>
</tblNotes>
<tblNotes>
<noteID>468</noteID>
<CandID>166</CandID>
<noteDate>2010-03-01T00:00:00</noteDate>
<note>Candidate advised dean that she would not be making campus visit (family reasons)</note>
</tblNotes>
<tblNotes>
<noteID>469</noteID>
<CandID>157</CandID>
<noteDate>2010-03-01T00:00:00</noteDate>
<note>On 2/25, Dr. Weinfurt met w/identified  faculty to dicuss interests and possible teaching role; Dean requested feedback from this visit be sent to DTS; no other known action for search committee at this time.</note>
</tblNotes>
<tblNotes>
<noteID>470</noteID>
<CandID>147</CandID>
<noteDate>2010-02-22T00:00:00</noteDate>
<note>Per B. Trey&apos;s conversation with candidate, candidate acknowledged qualifications were not a match to DAST postion; regret ltr sent 2/22/10.</note>
</tblNotes>
<tblNotes>
<noteID>471</noteID>
<CandID>189</CandID>
<noteDate>2010-03-11T00:00:00</noteDate>
<note>Dr. Nambisan called to inquiry status of application and was advised it is under review; Dr. Nambisan expressed strong interest in position in light of professional and personal circumstances (husband considering a position in this area)</note>
</tblNotes>
<tblNotes>
<noteID>472</noteID>
<CandID>211</CandID>
<noteDate>2010-03-31T00:00:00</noteDate>
<note>Candidate also wishes to be considered for HSR position</note>
</tblNotes>
<tblNotes>
<noteID>473</noteID>
<CandID>176</CandID>
<noteDate>2010-04-05T00:00:00</noteDate>
<note>Due to lack of clinical exp, committee recommends a regret ltr; regret ltr sent</note>
</tblNotes>
<tblNotes>
<noteID>474</noteID>
<CandID>175</CandID>
<noteDate>2010-04-05T00:00:00</noteDate>
<note>Due to lack of clinical exp, committee recommends regret ltr; regret ltr sent</note>
</tblNotes>
<tblNotes>
<noteID>475</noteID>
<CandID>183</CandID>
<noteDate>2010-04-05T00:00:00</noteDate>
<note>strong sr faculty; has similar teaching exp as a number of current faculty;  might have limited contributions in nsg; DEB to advise dean of recommendation of regret ltr</note>
</tblNotes>
<tblNotes>
<noteID>476</noteID>
<CandID>57</CandID>
<noteDate>2010-04-05T00:00:00</noteDate>
<note>Committee recommends continued recruitment; DHB to advise dean</note>
</tblNotes>
<tblNotes>
<noteID>477</noteID>
<CandID>208</CandID>
<noteDate>2010-04-05T00:00:00</noteDate>
<note>campus visit scheduled for 4/8-9/2010</note>
</tblNotes>
<tblNotes>
<noteID>478</noteID>
<CandID>205</CandID>
<noteDate>2010-04-05T00:00:00</noteDate>
<note>Terry Valiga to do phone screen re:  teaching experience and desires, and research program; see comments</note>
</tblNotes>
<tblNotes>
<noteID>479</noteID>
<CandID>173</CandID>
<noteDate>2010-04-05T00:00:00</noteDate>
<note>DLP to do phone screen re:  teaching experience and desires, and research program</note>
</tblNotes>
<tblNotes>
<noteID>480</noteID>
<CandID>184</CandID>
<noteDate>2010-04-05T00:00:00</noteDate>
<note>Committee recommends regret ltr</note>
</tblNotes>
<tblNotes>
<noteID>481</noteID>
<CandID>215</CandID>
<noteDate>2010-04-05T00:00:00</noteDate>
<note>Committee recommends regret ltr</note>
</tblNotes>
<tblNotes>
<noteID>482</noteID>
<CandID>206</CandID>
<noteDate>2010-04-05T00:00:00</noteDate>
<note>Committee recommends regret ltr</note>
</tblNotes>
<tblNotes>
<noteID>483</noteID>
<CandID>172</CandID>
<noteDate>2010-04-05T00:00:00</noteDate>
<note>Committee recommends regret ltr</note>
</tblNotes>
<tblNotes>
<noteID>484</noteID>
<CandID>212</CandID>
<noteDate>2010-04-05T00:00:00</noteDate>
<note>committee recommends regret ltr; regret ltr sent</note>
</tblNotes>
<tblNotes>
<noteID>485</noteID>
<CandID>201</CandID>
<noteDate>2010-04-05T00:00:00</noteDate>
<note>DHB to inform dean of recommendation for a campus visit</note>
</tblNotes>
<tblNotes>
<noteID>486</noteID>
<CandID>204</CandID>
<noteDate>2010-04-05T00:00:00</noteDate>
<note>Committee recommends regret ltr; regret ltr sent</note>
</tblNotes>
<tblNotes>
<noteID>487</noteID>
<CandID>188</CandID>
<noteDate>2010-04-05T00:00:00</noteDate>
<note>Hold pending Dekker&apos;s visit/disposition (possible ABSN adult health candidate)</note>
</tblNotes>
<tblNotes>
<noteID>488</noteID>
<CandID>207</CandID>
<noteDate>2010-04-05T00:00:00</noteDate>
<note>DLP to do phone screen; comments posted; recommendation for a regret ltr; regret ltr sent 6/17/2010</note>
</tblNotes>
<tblNotes>
<noteID>489</noteID>
<CandID>211</CandID>
<noteDate>2010-04-05T00:00:00</noteDate>
<note>Committee recommends regret ltr; regret ltr sent</note>
</tblNotes>
<tblNotes>
<noteID>490</noteID>
<CandID>210</CandID>
<noteDate>2010-04-05T00:00:00</noteDate>
<note>Informational to committee; two years</note>
</tblNotes>
<tblNotes>
<noteID>491</noteID>
<CandID>209</CandID>
<noteDate>2010-04-05T00:00:00</noteDate>
<note>no position matching candidate&apos;s experiences, committee recommends regret ltr; regret ltr sent 4/26</note>
</tblNotes>
<tblNotes>
<noteID>492</noteID>
<CandID>214</CandID>
<noteDate>2010-04-05T00:00:00</noteDate>
<note>DHB to advise dean of committee&apos;s recommendation for a regret ltr;</note>
</tblNotes>
<tblNotes>
<noteID>493</noteID>
<CandID>50</CandID>
<noteDate>2010-04-05T00:00:00</noteDate>
<note>Comm advises to close file;   ADAA has contaced candidate to advise that position has been filled.</note>
</tblNotes>
<tblNotes>
<noteID>494</noteID>
<CandID>178</CandID>
<noteDate>2010-04-05T00:00:00</noteDate>
<note>DHB to advise dean of committee recommends regret ltr (no practice); dean in agreement; regret ltr sent</note>
</tblNotes>
<tblNotes>
<noteID>495</noteID>
<CandID>189</CandID>
<noteDate>2010-04-05T00:00:00</noteDate>
<note>HOLD; refer to LLD should candidate follow up re: status</note>
</tblNotes>
<tblNotes>
<noteID>496</noteID>
<CandID>187</CandID>
<noteDate>2010-04-05T00:00:00</noteDate>
<note>Committee recommends regret ltr; regret ltr sent</note>
</tblNotes>
<tblNotes>
<noteID>497</noteID>
<CandID>186</CandID>
<noteDate>2010-04-05T00:00:00</noteDate>
<note>Committee recommends regret ltr; regret ltr sent</note>
</tblNotes>
<tblNotes>
<noteID>498</noteID>
<CandID>203</CandID>
<noteDate>2010-04-05T00:00:00</noteDate>
<note>committee recommends regret ltr; regret ltr sent</note>
</tblNotes>
<tblNotes>
<noteID>499</noteID>
<CandID>196</CandID>
<noteDate>2010-04-05T00:00:00</noteDate>
<note>committee recommends regret ltr; regret ltr sent</note>
</tblNotes>
<tblNotes>
<noteID>500</noteID>
<CandID>202</CandID>
<noteDate>2010-04-05T00:00:00</noteDate>
<note>Committee recommends regret ltr; regret ltr sent.</note>
</tblNotes>
<tblNotes>
<noteID>501</noteID>
<CandID>200</CandID>
<noteDate>2010-04-05T00:00:00</noteDate>
<note>Committee recommends regret ltr; regret ltr sent.</note>
</tblNotes>
<tblNotes>
<noteID>502</noteID>
<CandID>199</CandID>
<noteDate>2010-04-05T00:00:00</noteDate>
<note>Committee recommends regret ltr; regret ltr sent.</note>
</tblNotes>
<tblNotes>
<noteID>503</noteID>
<CandID>213</CandID>
<noteDate>2010-04-05T00:00:00</noteDate>
<note>Committee recommends regret ltr (personalize); regret ltr sent</note>
</tblNotes>
<tblNotes>
<noteID>504</noteID>
<CandID>172</CandID>
<noteDate>2010-04-28T00:00:00</noteDate>
<note>Hold regret ltr; pending new info re:  HSR position re-review</note>
</tblNotes>
<tblNotes>
<noteID>505</noteID>
<CandID>206</CandID>
<noteDate>2010-04-28T00:00:00</noteDate>
<note>Per DHB, hold regret ltr; re-review in light of new HSR info</note>
</tblNotes>
<tblNotes>
<noteID>506</noteID>
<CandID>215</CandID>
<noteDate>2010-04-28T00:00:00</noteDate>
<note>Per DHB, hold regret ltr; re-review in light of new HSR info</note>
</tblNotes>
<tblNotes>
<noteID>507</noteID>
<CandID>159</CandID>
<noteDate>2010-04-26T00:00:00</noteDate>
<note>Regret ltr sent</note>
</tblNotes>
<tblNotes>
<noteID>508</noteID>
<CandID>88</CandID>
<noteDate>2010-04-30T00:00:00</noteDate>
<note>Regret ltr sent</note>
</tblNotes>
<tblNotes>
<noteID>509</noteID>
<CandID>130</CandID>
<noteDate>2010-04-30T00:00:00</noteDate>
<note>Regret ltr sent</note>
</tblNotes>
<tblNotes>
<noteID>510</noteID>
<CandID>210</CandID>
<noteDate>2010-05-03T00:00:00</noteDate>
<note>DHB to contact candidate to determine MH&apos;s thinking at this point; dean proposed hire with two year out start date; dean suggested early campus visit</note>
</tblNotes>
<tblNotes>
<noteID>511</noteID>
<CandID>172</CandID>
<noteDate>2010-05-03T00:00:00</noteDate>
<note>Hold pending new  HSR pos description</note>
</tblNotes>
<tblNotes>
<noteID>512</noteID>
<CandID>217</CandID>
<noteDate>2010-05-03T00:00:00</noteDate>
<note>Committee recommends regret ltr.</note>
</tblNotes>
<tblNotes>
<noteID>513</noteID>
<CandID>214</CandID>
<noteDate>2010-05-04T00:00:00</noteDate>
<note>informed of possible 2nd HSR position; application revisited at May 3rd meeting; recommendation for &quot;soft&quot; regret ltr (per dean); regret ltr sent 5/12</note>
</tblNotes>
<tblNotes>
<noteID>514</noteID>
<CandID>184</CandID>
<noteDate>2010-05-04T00:00:00</noteDate>
<note>informed of possible 2nd HSR position (RN); application revisited at May 3rd meeting as candidate was in top tier but not RN; recommendation for regret ltr; candidate contacted chair directly via email re:  status of applicantion; chair informed candidate that he was not best match; regret ltr not needed.</note>
</tblNotes>
<tblNotes>
<noteID>515</noteID>
<CandID>183</CandID>
<noteDate>2010-05-04T00:00:00</noteDate>
<note>committee recommended regret ltr; dean suggested  &quot;not a match at this time&quot; regret ltr; regret ltr sent 5/12.</note>
</tblNotes>
<tblNotes>
<noteID>516</noteID>
<CandID>205</CandID>
<noteDate>2010-05-03T00:00:00</noteDate>
<note>committee recommends regret ltr; regret ltr sent 5/12/2010.</note>
</tblNotes>
<tblNotes>
<noteID>517</noteID>
<CandID>173</CandID>
<noteDate>2010-05-03T00:00:00</noteDate>
<note>committee recommends regret ltr; regret ltr sent 05/12/2010.</note>
</tblNotes>
<tblNotes>
<noteID>518</noteID>
<CandID>215</CandID>
<noteDate>2010-05-03T00:00:00</noteDate>
<note>Committee recommends regret ltr; regret ltr sent 5/12/2010.</note>
</tblNotes>
<tblNotes>
<noteID>519</noteID>
<CandID>189</CandID>
<noteDate>2010-05-03T00:00:00</noteDate>
<note>Committee recommends regret ltr; regret ltr sent 5/12/10.</note>
</tblNotes>
<tblNotes>
<noteID>520</noteID>
<CandID>216</CandID>
<noteDate>2010-05-03T00:00:00</noteDate>
<note>Committee recommends regret ltr; ltr sent 5/12/2010.</note>
</tblNotes>
<tblNotes>
<noteID>521</noteID>
<CandID>219</CandID>
<noteDate>2010-05-03T00:00:00</noteDate>
<note>Committee recommends regret ltr; ltr sent 5/12/10</note>
</tblNotes>
<tblNotes>
<noteID>522</noteID>
<CandID>218</CandID>
<noteDate>2010-05-03T00:00:00</noteDate>
<note>Committee suggests consider candidate for ABSN adult health if needed; DHB to call</note>
</tblNotes>
<tblNotes>
<noteID>523</noteID>
<CandID>170</CandID>
<noteDate>2010-04-05T00:00:00</noteDate>
<note>No respone from BT; position filled.</note>
</tblNotes>
<tblNotes>
<noteID>524</noteID>
<CandID>161</CandID>
<noteDate>2010-05-10T00:00:00</noteDate>
<note>Candidate advised dean that she has accepted another offer.</note>
</tblNotes>
<tblNotes>
<noteID>525</noteID>
<CandID>201</CandID>
<noteDate>2010-05-28T00:00:00</noteDate>
<note>Committee chair spoke to candidate via phone and advised of decision not to continue candidacy</note>
</tblNotes>
<tblNotes>
<noteID>526</noteID>
<CandID>221</CandID>
<noteDate>2010-06-07T00:00:00</noteDate>
<note>Search committee recommends regret ltr; regret ltr sent 6/10/10</note>
</tblNotes>
<tblNotes>
<noteID>527</noteID>
<CandID>222</CandID>
<noteDate>2010-06-07T00:00:00</noteDate>
<note>TV to contact candidate for phone interview and report back to the committee; an initial mtg w/search committee members to be planned prior to candidate&apos;s trip out of the country July 9-Aug 8</note>
</tblNotes>
<tblNotes>
<noteID>528</noteID>
<CandID>223</CandID>
<noteDate>2010-06-07T00:00:00</noteDate>
<note>Committee recommends regret ltr; regret ltr sent 6/10/10</note>
</tblNotes>
<tblNotes>
<noteID>529</noteID>
<CandID>188</CandID>
<noteDate>2010-06-07T00:00:00</noteDate>
<note>Following Dekker ouctome, CB reported positive phone interview w/candidate re:  ABSN adult health position; CB to check to check references</note>
</tblNotes>
<tblNotes>
<noteID>530</noteID>
<CandID>218</CandID>
<noteDate>2010-06-07T00:00:00</noteDate>
<note>following Dekker outcome, candidate to be considered for ABSN adult position and possibly HSR position; DLP to call candidate re:  both positions after new HSR position is finalized</note>
</tblNotes>
<tblNotes>
<noteID>531</noteID>
<CandID>225</CandID>
<noteDate>2010-06-07T00:00:00</noteDate>
<note>Committee recommends regret ltr; regret ltr sent 6/10.</note>
</tblNotes>
<tblNotes>
<noteID>532</noteID>
<CandID>224</CandID>
<noteDate>2010-06-07T00:00:00</noteDate>
<note>Committee recommends regret ltr; regret ltr sent 6/10</note>
</tblNotes>
<tblNotes>
<noteID>533</noteID>
<CandID>206</CandID>
<noteDate>2010-06-07T00:00:00</noteDate>
<note>Committee planned to revisit w. new HSR position description; candidate did not match draft of EBP position description; committee recommends regret ltr indicating HSR position has been filled/will keep materials on file; regret ltr sent 6/10/10</note>
</tblNotes>
<tblNotes>
<noteID>534</noteID>
<CandID>172</CandID>
<noteDate>2010-06-07T00:00:00</noteDate>
<note>ommittee planned to revisit w. new HSR position description; candidate did not match draft of EBP position description; committee recommends regret ltr indicating HSR position has been filled/will keep materials on file.</note>
</tblNotes>
<tblNotes>
<noteID>535</noteID>
<CandID>166</CandID>
<noteDate>2010-06-29T00:00:00</noteDate>
<note>CEB, DHB to be in touch with candidate in Nov. 2010</note>
</tblNotes>
<tblNotes>
<noteID>536</noteID>
<CandID>227</CandID>
<noteDate>2010-07-12T00:00:00</noteDate>
<note>DHB to contact candidate and advise that she will be considered once her defense date is set (contact pending outcome of Nash visit); see DHB email of 7/13/10 and candidate&apos;s ltr of 7/14/10 in candidate&apos;s folder</note>
</tblNotes>
<tblNotes>
<noteID>537</noteID>
<CandID>226</CandID>
<noteDate>2010-07-12T00:00:00</noteDate>
<note>Committee recommends regret ltr - regret ltr sent 7/15/10</note>
</tblNotes>
<tblNotes>
<noteID>538</noteID>
<CandID>230</CandID>
<noteDate>2010-07-12T00:00:00</noteDate>
<note>CMJ had TC with candidate; LLD to f/u with candidate following DHB talking to CMJ re:  candidate.</note>
</tblNotes>
<tblNotes>
<noteID>539</noteID>
<CandID>228</CandID>
<noteDate>2010-07-12T00:00:00</noteDate>
<note>CMJ to have dinner mtg with candidate; possible regret ltr pending dinner with Constance</note>
</tblNotes>
<tblNotes>
<noteID>540</noteID>
<CandID>228</CandID>
<noteDate>2010-07-13T00:00:00</noteDate>
<note>Per DHB, CMJ indicated candidate to be a better candidate for future CRM position; it was agreed to send regret ltr - regret ltr sent 7/15/10</note>
</tblNotes>
<tblNotes>
<noteID>541</noteID>
<CandID>230</CandID>
<noteDate>2010-07-13T00:00:00</noteDate>
<note>Per DHB - following CMJ&apos;s call w/candidate, regret ltr is recommended; regret ltr sent 7/15/10.</note>
</tblNotes>
<tblNotes>
<noteID>542</noteID>
<CandID>188</CandID>
<noteDate>2010-07-14T00:00:00</noteDate>
<note>In TC w/CEB, candidate advised of desire to remain in graduate teaching and  that she would be withdrawing her candidacy for ABSN adult health position; candidate emailed notice of withdrawal to CCA; campus visit cancelled; file closed</note>
</tblNotes>
<tblNotes>
<noteID>543</noteID>
<CandID>218</CandID>
<noteDate>2010-08-03T00:00:00</noteDate>
<note>DLP contacted candidate re:  EBP position - see comments; committee recommends regret ltr; regret ltr sent 8/13/10</note>
</tblNotes>
<tblNotes>
<noteID>544</noteID>
<CandID>232</CandID>
<noteDate>2010-08-03T00:00:00</noteDate>
<note>Based on consensus comments from committee, committee recommends regret ltr; regret ltr sent 8/13/10.</note>
</tblNotes>
<tblNotes>
<noteID>545</noteID>
<CandID>235</CandID>
<note>Visa would need to be transferred and need Duke to sponsor; TV to do phone screen w/candidate and reference checks;</note>
</tblNotes>
<tblNotes>
<noteID>546</noteID>
<CandID>233</CandID>
<noteDate>2010-08-03T00:00:00</noteDate>
<note>CEB to do phone interview with candidate and ask for references</note>
</tblNotes>
<tblNotes>
<noteID>547</noteID>
<CandID>231</CandID>
<noteDate>2010-08-03T00:00:00</noteDate>
<note>DHB to contact candidate re:  psych exp, grant scores</note>
</tblNotes>
<tblNotes>
<noteID>548</noteID>
<CandID>66</CandID>
<noteDate>2010-08-03T00:00:00</noteDate>
<note>CEB spoke to candidate in ONS 5/10; candidate has accepted a position in NW University</note>
</tblNotes>
<tblNotes>
<noteID>549</noteID>
<CandID>233</CandID>
<noteDate>2010-08-13T00:00:00</noteDate>
<note>Following conversation w/CEB, in email of 8/12/10 to CEB, candidate withdrew application for faculty position.</note>
</tblNotes>
<tblNotes>
<noteID>550</noteID>
<CandID>210</CandID>
<noteDate>2010-09-01T00:00:00</noteDate>
<note>Committee recommends continued recruitment based on evals;  chair to forward to dean</note>
</tblNotes>
<tblNotes>
<noteID>551</noteID>
<CandID>231</CandID>
<noteDate>2010-09-01T00:00:00</noteDate>
<note>1) committee recommends in light of strong post doc, poised for a K award, a candidate visit;  TW to request updated CV to reflect teaching experiences.</note>
</tblNotes>
<tblNotes>
<noteID>552</noteID>
<CandID>235</CandID>
<noteDate>2010-09-01T00:00:00</noteDate>
<note>based on positive recommendations (2), committee to recommend a campus visit</note>
</tblNotes>
<tblNotes>
<noteID>553</noteID>
<CandID>239</CandID>
<noteDate>2010-09-01T00:00:00</noteDate>
<note>committee members to post comments and revisit review at Oct mtg</note>
</tblNotes>
<tblNotes>
<noteID>554</noteID>
<CandID>235</CandID>
<noteDate>2010-09-07T00:00:00</noteDate>
<note>In response to invitation for campus visit, candidate advised committee chair that he had accepted another position.</note>
</tblNotes>
<tblNotes>
<noteID>555</noteID>
<CandID>241</CandID>
<noteDate>2010-10-04T00:00:00</noteDate>
<note>committee recommends visit near other absn mental health candidate&apos;s visit</note>
</tblNotes>
<tblNotes>
<noteID>556</noteID>
<CandID>238</CandID>
<noteDate>2010-10-04T00:00:00</noteDate>
<note>MEZ to complete reference checks and will advise committee; if positive visit recommendation</note>
</tblNotes>
<tblNotes>
<noteID>557</noteID>
<CandID>240</CandID>
<noteDate>2010-10-04T00:00:00</noteDate>
<note>RAA to complete ref checks; if positive a visit recommendation to the dean</note>
</tblNotes>
<tblNotes>
<noteID>558</noteID>
<CandID>239</CandID>
<noteDate>2010-10-04T00:00:00</noteDate>
<note>DHB to do intial screen and proceed with ref checks</note>
</tblNotes>
<tblNotes>
<noteID>559</noteID>
<CandID>242</CandID>
<noteDate>2010-10-04T00:00:00</noteDate>
<note>TV to call candidate</note>
</tblNotes>
<tblNotes>
<noteID>560</noteID>
<CandID>244</CandID>
<noteDate>2010-10-04T00:00:00</noteDate>
<note>hold pending outcome of Wu candidacy; TW to review CV for possible ABSN adult position</note>
</tblNotes>
<tblNotes>
<noteID>561</noteID>
<CandID>243</CandID>
<noteDate>2010-10-27T00:00:00</noteDate>
<note> TW to do phone screen with candidate</note>
</tblNotes>
<tblNotes>
<noteID>562</noteID>
<CandID>227</CandID>
<noteDate>2010-10-04T00:00:00</noteDate>
<note>DHB to do reference checks</note>
</tblNotes>
<tblNotes>
<noteID>563</noteID>
<CandID>245</CandID>
<noteDate>2010-10-04T00:00:00</noteDate>
<note>regret ltr to be sent; regret ltr sent 10/08/10</note>
</tblNotes>
<tblNotes>
<noteID>564</noteID>
<CandID>246</CandID>
<noteDate>2010-10-04T00:00:00</noteDate>
<note>MEZ will do phone screen and ref checks if appropriate</note>
</tblNotes>
<tblNotes>
<noteID>565</noteID>
<CandID>240</CandID>
<noteDate>2010-10-12T00:00:00</noteDate>
<note>based on dean&apos;s due diligence, candidacy will not continue; regret ltr sent.</note>
</tblNotes>
<tblNotes>
<noteID>566</noteID>
<CandID>244</CandID>
<noteDate>2010-10-22T00:00:00</noteDate>
<note>Per TW email of 10/21 upon re view of the candidate&apos;s CV,  Dr. Kao does not demonstrate qualifications/expectations the ABSN team  has for the adult health faculty position; committee advised regret ltr to be sent; regret ltr sent 10/23.</note>
</tblNotes>
<tblNotes>
<noteID>567</noteID>
<CandID>249</CandID>
<noteDate>2010-11-08T00:00:00</noteDate>
<note>Committee recommends candidate resubmit application closer to defense date (currently Dec. 2011); this will be communicated to candidate; ltr sent 11/9/10</note>
</tblNotes>
<tblNotes>
<noteID>568</noteID>
<CandID>239</CandID>
<noteDate>2010-11-08T00:00:00</noteDate>
<note>DHB to complete reference checks.  Re:  dissertation:  manuscript due in Dec; expects to complete May 2011.  Pending positive references, a request for visit will be made.</note>
</tblNotes>
<tblNotes>
<noteID>569</noteID>
<CandID>238</CandID>
<noteDate>2010-11-08T00:00:00</noteDate>
<note>Based on other due diligence; committee recommends not continue candidacy and regret ltr; ltr sent 11/9/10</note>
</tblNotes>
<tblNotes>
<noteID>570</noteID>
<CandID>242</CandID>
<noteDate>2010-11-08T00:00:00</noteDate>
<note>Pending final reference checks, a request will be made for a campus visit for FNP position</note>
</tblNotes>
<tblNotes>
<noteID>571</noteID>
<CandID>246</CandID>
<noteDate>2010-11-08T00:00:00</noteDate>
<note>Pending ref checks, a recommendation for a campus visit will be made</note>
</tblNotes>
<tblNotes>
<noteID>572</noteID>
<CandID>248</CandID>
<noteDate>2010-11-08T00:00:00</noteDate>
<note>MEZ to notify group when ref checks complete; and committee will respond re:  recommendation for visit</note>
</tblNotes>
<tblNotes>
<noteID>573</noteID>
<CandID>227</CandID>
<noteDate>2010-11-08T00:00:00</noteDate>
<note>DHB reported  positive ref checks and candidate has no proposal or defense date;  candidate will be advised to determine a date that can be confirmed by her chair to be considered for position</note>
</tblNotes>
<tblNotes>
<noteID>574</noteID>
<CandID>243</CandID>
<noteDate>2010-11-08T00:00:00</noteDate>
<note>TW reported candidate interested in TT postion, and  positive ref checks; defense date of May 2011 confirmed; committee recommends campus visit</note>
</tblNotes>
<tblNotes>
<noteID>575</noteID>
<CandID>251</CandID>
<noteDate>2010-11-08T00:00:00</noteDate>
<note>DHB completed interview and will conduct ref checks; candidate was asked to forward an updated CV</note>
</tblNotes>
<tblNotes>
<noteID>576</noteID>
<CandID>247</CandID>
<noteDate>2010-11-08T00:00:00</noteDate>
<note>RAA to conduct phone screen and if positive do ref checks</note>
</tblNotes>
<tblNotes>
<noteID>577</noteID>
<CandID>254</CandID>
<noteDate>2010-11-08T00:00:00</noteDate>
<note>Terry V to do phone interview and ref checks</note>
</tblNotes>
<tblNotes>
<noteID>578</noteID>
<CandID>252</CandID>
<noteDate>2010-11-08T00:00:00</noteDate>
<note>TV to do phone screen and ref check</note>
</tblNotes>
<tblNotes>
<noteID>580</noteID>
<CandID>231</CandID>
<noteDate>2010-11-08T00:00:00</noteDate>
<note>Committee prepared recommendation to dean; awaiting evals from M. Toles&apos; visit to complete ABSN/psych recommendation</note>
</tblNotes>
<tblNotes>
<noteID>581</noteID>
<CandID>241</CandID>
<noteDate>2010-11-08T00:00:00</noteDate>
<note>Committee prepared recommendation to dean; awaiting evals from M. Toles&apos; visit to complete ABSN/psych recommendation</note>
</tblNotes>
<tblNotes>
<noteID>582</noteID>
<CandID>255</CandID>
<noteDate>2010-11-08T00:00:00</noteDate>
<note>CMJ provided comments; committee to review with any other candidates following AMIA mtg</note>
</tblNotes>
<tblNotes>
<noteID>583</noteID>
<CandID>261</CandID>
<noteDate>2010-11-10T00:00:00</noteDate>
<note>DHB to contact MPP re: candidate</note>
</tblNotes>
<tblNotes>
<noteID>584</noteID>
<CandID>247</CandID>
<noteDate>2010-11-15T00:00:00</noteDate>
<note>I had a long conversation with Dr. Tracey Yap and she appears to be a good fit with research at Duke and for the implementation science position.   Unless I hear otherwise, I will work on getting the references.  I will be out of town beginning tomorrow and will be back on Wed (day before Thanksgiving) do I probably won&apos;t make much progress until after Thanksgiving.  Ruth</note>
</tblNotes>
<tblNotes>
<noteID>585</noteID>
<CandID>227</CandID>
<noteDate>2010-11-29T00:00:00</noteDate>
<note>DHB advised candidate that plans for a campus visit could proceed once candidate has a defense date has been set and diss chair has Okd defense date</note>
</tblNotes>
<tblNotes>
<noteID>586</noteID>
<CandID>243</CandID>
<noteDate>2010-12-02T00:00:00</noteDate>
<note>TW confirmed in email of 12/2/ candidate&apos;s defense date of 4/11/2011</note>
</tblNotes>
<tblNotes>
<noteID>587</noteID>
<CandID>231</CandID>
<noteDate>2010-12-02T00:00:00</noteDate>
<note>Candidate emailed that she had accepted another position that was more congruent to her career.</note>
</tblNotes>
<tblNotes>
<noteID>588</noteID>
<CandID>261</CandID>
<noteDate>2010-12-06T00:00:00</noteDate>
<note>Committee recommends a phone screen; ask candidate re:  part time reference and defense date</note>
</tblNotes>
<tblNotes>
<noteID>590</noteID>
<CandID>262</CandID>
<noteDate>2010-12-06T00:00:00</noteDate>
<note>Candidate is not a nurse, a stated qualification for the position; regret to be sent; ltr sent 12/7</note>
</tblNotes>
<tblNotes>
<noteID>591</noteID>
<CandID>267</CandID>
<noteDate>2010-12-06T00:00:00</noteDate>
<note>Committee recommends phone screen of candidate</note>
</tblNotes>
<tblNotes>
<noteID>592</noteID>
<CandID>263</CandID>
<noteDate>2010-12-06T00:00:00</noteDate>
<note>Committee recommends regret ltr; ltr sent 12/7</note>
</tblNotes>
<tblNotes>
<noteID>593</noteID>
<CandID>266</CandID>
<noteDate>2010-12-06T00:00:00</noteDate>
<note>Committee recommends phone screen</note>
</tblNotes>
<tblNotes>
<noteID>594</noteID>
<CandID>255</CandID>
<noteDate>2010-12-06T00:00:00</noteDate>
<note>committee recommends phone screen</note>
</tblNotes>
<tblNotes>
<noteID>595</noteID>
<CandID>260</CandID>
<noteDate>2010-12-06T00:00:00</noteDate>
<note>Committee recommends phone screen</note>
</tblNotes>
<tblNotes>
<noteID>596</noteID>
<CandID>254</CandID>
<noteDate>2010-12-06T00:00:00</noteDate>
<note>Based on  TV email of 11/28 that follows, committee agreed that candidate will receive a regret ltr; ltr sent 12/7.  On Song    While her 2 references were extremely positive about her abilities as a researcher, none could comment on her teaching and none could offer any examples or supportive comments regarding her demonstrated leadership of EBP and implementation science initiatives as called for in our position description.  Additionally, when I spoke with this candidate about EBP, all she could talk about was using evidence to underlie her own clinical practice as an RN.  When I asked about implementation science, she really did not seem to know what I was talking about and kept talking about doing research.  Additionally, she asked many questions about the DNP program, almost as if she knew nothing about that kind of program.  To be honest, she sounded delightful, she seems to be quite exceptional as a researcher, and her references were extremely supportive    but I did not get the sense that she has the experience, understanding or leadership in EBP/implementation science to meet the qualifications we posted.  My initial recommendation is to NOT proceed to a visit, but I would welcome the opportunity for our committee to discuss this.</note>
</tblNotes>
<tblNotes>
<noteID>597</noteID>
<CandID>250</CandID>
<noteDate>2010-12-07T00:00:00</noteDate>
<note>Candidate advised DHB that M. Naylor confirmed as mentor  for post doc.</note>
</tblNotes>
<tblNotes>
<noteID>598</noteID>
<CandID>252</CandID>
<noteDate>2011-05-02T00:00:00</noteDate>
<note>candidate declined offer due to husband&apos;s job prospects failing through</note>
</tblNotes>
<tblNotes>
<noteID>599</noteID>
<CandID>255</CandID>
<noteDate>2010-12-13T00:00:00</noteDate>
<note>Based on TV email and phone interview comment, recommendation not to pursue candidate.</note>
</tblNotes>
<tblNotes>
<noteID>600</noteID>
<CandID>270</CandID>
<note>Per recommendations from 1/3 committee mtg, regret ltr sent 1/6/10</note>
</tblNotes>
<tblNotes>
<noteID>601</noteID>
<CandID>261</CandID>
<noteDate>2011-01-06T00:00:00</noteDate>
<note>Per committee discussion and recommendations of 1/3 mtg, regret ltr sent 1/6</note>
</tblNotes>
<tblNotes>
<noteID>602</noteID>
<CandID>242</CandID>
<noteDate>2011-01-06T00:00:00</noteDate>
<note>Per committee review of evals, discussion and recommendations of 1/3 mtg, regret ltr sent 1/6</note>
</tblNotes>
<tblNotes>
<noteID>603</noteID>
<CandID>258</CandID>
<noteDate>2011-01-06T00:00:00</noteDate>
<note>Per recommendations of committee during 1/3 mtg, regret letter sent 1/6</note>
</tblNotes>
<tblNotes>
<noteID>604</noteID>
<CandID>255</CandID>
<noteDate>2011-01-06T00:00:00</noteDate>
<note>Per committee recommendations during 1/3 mtg, regret ltr sent 1/6</note>
</tblNotes>
<tblNotes>
<noteID>605</noteID>
<CandID>271</CandID>
<noteDate>2011-01-06T00:00:00</noteDate>
<note>Per committee discussion and recommendations of 1/3 mtg, regret ltr sent 1/6</note>
</tblNotes>
<tblNotes>
<noteID>606</noteID>
<CandID>272</CandID>
<noteDate>2011-01-06T00:00:00</noteDate>
<note>Per committee discussion and recommendations of 1/3 mtg, regret ltr sent 1/6</note>
</tblNotes>
<tblNotes>
<noteID>608</noteID>
<CandID>266</CandID>
<noteDate>2011-02-07T00:00:00</noteDate>
<note>following eval review, the committee recommends do not continue recruitment - to be forwarded to the dean; candidate to be notified - ltr sent.</note>
</tblNotes>
<tblNotes>
<noteID>609</noteID>
<CandID>260</CandID>
<noteDate>2011-02-07T00:00:00</noteDate>
<note>recommend  visit</note>
</tblNotes>
<tblNotes>
<noteID>610</noteID>
<CandID>264</CandID>
<noteDate>2011-02-07T00:00:00</noteDate>
<note>committee receommends regret ltr; ltr sent 2/16/2011</note>
</tblNotes>
<tblNotes>
<noteID>611</noteID>
<CandID>283</CandID>
<noteDate>2011-02-07T00:00:00</noteDate>
<note>committee recommends regret ltr;  ltr sent 2/16/2011</note>
</tblNotes>
<tblNotes>
<noteID>612</noteID>
<CandID>284</CandID>
<noteDate>2011-02-07T00:00:00</noteDate>
<note>hold pending other candidates</note>
</tblNotes>
<tblNotes>
<noteID>613</noteID>
<CandID>278</CandID>
<noteDate>2011-02-07T00:00:00</noteDate>
<note>committee recommends regret ltr; ltr sent 2/16/2011</note>
</tblNotes>
<tblNotes>
<noteID>614</noteID>
<CandID>280</CandID>
<noteDate>2011-02-07T00:00:00</noteDate>
<note>chair to emial candidate to request additional infor re: position, rank, track to further review</note>
</tblNotes>
<tblNotes>
<noteID>615</noteID>
<CandID>273</CandID>
<noteDate>2011-02-07T00:00:00</noteDate>
<note>Committee recommends regret ltr; ltr sent 2/16/2011</note>
</tblNotes>
<tblNotes>
<noteID>616</noteID>
<CandID>282</CandID>
<noteDate>2011-02-07T00:00:00</noteDate>
<note>committee recommends regret ltr; ltr sent 2/16/2011</note>
</tblNotes>
<tblNotes>
<noteID>617</noteID>
<CandID>243</CandID>
<noteDate>2011-02-07T00:00:00</noteDate>
<note>Committee reviewed evals; recommended do not continue recruitment; recommend to be forwarded to dean</note>
</tblNotes>
<tblNotes>
<noteID>618</noteID>
<CandID>285</CandID>
<noteDate>2011-02-07T00:00:00</noteDate>
<note>Committee recommends regret ltr; ltr sent via email 2/22/11</note>
</tblNotes>
<tblNotes>
<noteID>619</noteID>
<CandID>279</CandID>
<noteDate>2011-02-07T00:00:00</noteDate>
<note>Committee recommends regret ltr; ltr send 2/16/2011</note>
</tblNotes>
<tblNotes>
<noteID>620</noteID>
<CandID>289</CandID>
<noteDate>2011-03-07T00:00:00</noteDate>
<note>not a viable candidate for EBP or ABSN position; regret ltr for AACNP; regret ltr sent 3/15/2011</note>
</tblNotes>
<tblNotes>
<noteID>621</noteID>
<CandID>288</CandID>
<noteDate>2011-03-07T00:00:00</noteDate>
<note>committee recommends regret ltr; regret ltr sent 3/15/2011</note>
</tblNotes>
<tblNotes>
<noteID>622</noteID>
<CandID>290</CandID>
<noteDate>2011-03-07T00:00:00</noteDate>
<note>no compelling reason to pursue; migratory; committee recommends regret ltr; regret ltr sent 3/15/11</note>
</tblNotes>
<tblNotes>
<noteID>623</noteID>
<CandID>291</CandID>
<noteDate>2011-03-07T00:00:00</noteDate>
<note>based on review committee recommends regret ltr; several short employment stints; regret ltr sent 3/15/2011</note>
</tblNotes>
<tblNotes>
<noteID>625</noteID>
<CandID>277</CandID>
<noteDate>2011-03-07T00:00:00</noteDate>
<note>committee recommends campus visit</note>
</tblNotes>
<tblNotes>
<noteID>626</noteID>
<CandID>280</CandID>
<noteDate>2011-03-07T00:00:00</noteDate>
<note>Candidate requested TC w/APT chair re:  appointment criteria; spoke with chair on 3/3; candidate to be back in touch</note>
</tblNotes>
<tblNotes>
<noteID>627</noteID>
<CandID>292</CandID>
<note>committee recommends regret ltr; regret ltr sent 3/15/2011</note>
</tblNotes>
<tblNotes>
<noteID>628</noteID>
<CandID>294</CandID>
<noteDate>2011-03-07T00:00:00</noteDate>
<note>MEZ to arrange skype session with candidate</note>
</tblNotes>
<tblNotes>
<noteID>629</noteID>
<CandID>286</CandID>
<noteDate>2011-03-07T00:00:00</noteDate>
<note>Committee recommends regret ltr; regret ltr sent 3/15/2011</note>
</tblNotes>
<tblNotes>
<noteID>630</noteID>
<CandID>280</CandID>
<noteDate>2011-03-09T00:00:00</noteDate>
<note>candidate had TC w/ APT on 3/3;  3/9 candidate decid withdrew application from consideration via email - file closed.</note>
</tblNotes>
<tblNotes>
<noteID>631</noteID>
<CandID>295</CandID>
<noteDate>2011-04-04T00:00:00</noteDate>
<note>Committee recommends regret ltr; regret ltr sent 04082011</note>
</tblNotes>
<tblNotes>
<noteID>632</noteID>
<CandID>296</CandID>
<noteDate>2011-04-04T00:00:00</noteDate>
<note>committee recommends regret ltr; regret ltr sent 040811.</note>
</tblNotes>
<tblNotes>
<noteID>633</noteID>
<CandID>259</CandID>
<noteDate>2011-04-04T00:00:00</noteDate>
<note>Per conversation with CMJohnson, OK to send regret ltr in light of other candidates; regret ltr sent 4/8/2011</note>
</tblNotes>
<tblNotes>
<noteID>634</noteID>
<CandID>260</CandID>
<noteDate>2011-04-04T00:00:00</noteDate>
<note>Committee reviewed evals from campus visit; determined not the best match for position at this time and will advise candidate that research is promising and would benefit from time in post doc; regret ltr sent 4/7/11</note>
</tblNotes>
<tblNotes>
<noteID>635</noteID>
<CandID>246</CandID>
<noteDate>2011-04-12T00:00:00</noteDate>
<note>Candidate advised by program chair of decision to hire another candidate</note>
</tblNotes>
<tblNotes>
<noteID>636</noteID>
<CandID>267</CandID>
<noteDate>2011-04-16T00:00:00</noteDate>
<note>Candidate accepted another position and withdrew application</note>
</tblNotes>
<tblNotes>
<noteID>637</noteID>
<CandID>298</CandID>
<noteDate>2011-05-02T00:00:00</noteDate>
<note>committee recommends regret ltr; ltr sent 5/10/11</note>
</tblNotes>
<tblNotes>
<noteID>638</noteID>
<CandID>302</CandID>
<noteDate>2011-05-10T00:00:00</noteDate>
<note>Committee recommends regret ltr; ltr sent 5/10/11</note>
</tblNotes>
<tblNotes>
<noteID>639</noteID>
<CandID>306</CandID>
<noteDate>2011-05-02T00:00:00</noteDate>
<note>Committee recommends regret ltr; ltr sent 5/10/11</note>
</tblNotes>
<tblNotes>
<noteID>640</noteID>
<CandID>269</CandID>
<noteDate>2011-05-10T00:00:00</noteDate>
<note>Hold pending Peterson</note>
</tblNotes>
<tblNotes>
<noteID>641</noteID>
<CandID>269</CandID>
<noteDate>2011-03-07T00:00:00</noteDate>
<note>Hold pending Mustillo and Viswanathan</note>
</tblNotes>
<tblNotes>
<noteID>642</noteID>
<CandID>284</CandID>
<noteDate>2011-05-02T00:00:00</noteDate>
<note>Hold pending Peterson</note>
</tblNotes>
<tblNotes>
<noteID>643</noteID>
<CandID>265</CandID>
<note>hold pending outcome of Otake and Richenson</note>
</tblNotes>
<tblNotes>
<noteID>644</noteID>
<CandID>300</CandID>
<noteDate>2011-05-05T00:00:00</noteDate>
<note>Per discussion with DHB and SH review, candidate does not meet admin exp qualification; regret ltr sent 5/10/11</note>
</tblNotes>
<tblNotes>
<noteID>645</noteID>
<CandID>305</CandID>
<noteDate>2011-05-18T00:00:00</noteDate>
<note>Following telephone screen, ref checks and invitation for campus visit, candidate advised that he wished to remain at his current institution</note>
</tblNotes>
<tblNotes>
<noteID>646</noteID>
<CandID>294</CandID>
<noteDate>2011-05-29T00:00:00</noteDate>
<note>Per DHB, decision made to send candidate a regret ltr; regret ltr sent 5/30/11</note>
</tblNotes>
<tblNotes>
<noteID>647</noteID>
<CandID>307</CandID>
<noteDate>2011-06-13T00:00:00</noteDate>
<note>MEZ was to conduct reference checks however committee decision to conduct reference checks after visit; recommendation for visit.</note>
</tblNotes>
<tblNotes>
<noteID>648</noteID>
<CandID>308</CandID>
<noteDate>2011-06-13T00:00:00</noteDate>
<note>TV to do phone screen once DHB clarifies status of ABSN/adult health position</note>
</tblNotes>
<tblNotes>
<noteID>649</noteID>
<CandID>310</CandID>
<noteDate>2011-06-13T00:00:00</noteDate>
<note>DHB to do in person screen w/ candidate - candidate is in town this week.</note>
</tblNotes>
<tblNotes>
<noteID>650</noteID>
<CandID>313</CandID>
<noteDate>2011-06-13T00:00:00</noteDate>
<note>committee recommends regret ltr (candidate is ANP, position is FNP); regret ltr sent 6/16/11</note>
</tblNotes>
<tblNotes>
<noteID>651</noteID>
<CandID>312</CandID>
<noteDate>2011-06-13T00:00:00</noteDate>
<note>Committee recommends a regret ltr; regret ltr sent 6/16/11</note>
</tblNotes>
<tblNotes>
<noteID>652</noteID>
<CandID>297</CandID>
<noteDate>2011-06-13T00:00:00</noteDate>
<note>Hold  pending candidate&apos;s return in Aug and pending other candidate</note>
</tblNotes>
<tblNotes>
<noteID>653</noteID>
<CandID>303</CandID>
<noteDate>2011-06-13T00:00:00</noteDate>
<note>RAA to continue with reference checks</note>
</tblNotes>
<tblNotes>
<noteID>654</noteID>
<CandID>304</CandID>
<noteDate>2011-06-13T00:00:00</noteDate>
<note>committee recommends visit</note>
</tblNotes>
<tblNotes>
<noteID>655</noteID>
<CandID>284</CandID>
<noteDate>2011-06-13T00:00:00</noteDate>
<note>MEZ to do phone screen</note>
</tblNotes>
<tblNotes>
<noteID>656</noteID>
<CandID>309</CandID>
<noteDate>2011-06-06T00:00:00</noteDate>
<note>Since applicant applied, EBP/IS position has been filled;ltr to candidate to advise recruitment no longer open 061611</note>
</tblNotes>
<tblNotes>
<noteID>657</noteID>
<CandID>311</CandID>
<noteDate>2011-06-13T00:00:00</noteDate>
<note>ltr to candidate to advise recruitment no longer open 061611</note>
</tblNotes>
<tblNotes>
<noteID>658</noteID>
<CandID>287</CandID>
<noteDate>2011-06-02T00:00:00</noteDate>
<note>Candidate notified CA that he has withdrawn his application (accepted another position)</note>
</tblNotes>
<tblNotes>
<noteID>659</noteID>
<CandID>268</CandID>
<noteDate>2011-05-24T00:00:00</noteDate>
<note>Candidate notified the school would not be continuing her candidacy.</note>
</tblNotes>
<tblNotes>
<noteID>660</noteID>
<CandID>265</CandID>
<noteDate>2011-06-13T00:00:00</noteDate>
<note>committee recommends regret ltr; ltr sent 06162011</note>
</tblNotes>
<tblNotes>
<noteID>661</noteID>
<CandID>269</CandID>
<noteDate>2011-06-16T00:00:00</noteDate>
<note>Terry W to do phone screen</note>
</tblNotes>
<tblNotes>
<noteID>662</noteID>
<CandID>250</CandID>
<noteDate>2011-06-13T00:00:00</noteDate>
<note>Mark will begin a post doc at DUSON.</note>
</tblNotes>
<tblNotes>
<noteID>663</noteID>
<CandID>243</CandID>
<noteDate>2011-06-13T00:00:00</noteDate>
<note>Candidate accepted a position at UNCW</note>
</tblNotes>
<tblNotes>
<noteID>664</noteID>
<CandID>314</CandID>
<noteDate>2011-06-30T00:00:00</noteDate>
<note>Per email review and communication, candidate to receive a regret ltr (lack of comm health experience). Regret ltr sent 6/30/2011</note>
</tblNotes>
<tblNotes>
<noteID>665</noteID>
<CandID>301</CandID>
<noteDate>2011-05-02T00:00:00</noteDate>
<note>Committee recommends regret ltr; regret ltr sent 5/10/11</note>
</tblNotes>
<tblNotes>
<noteID>666</noteID>
<CandID>308</CandID>
<noteDate>2011-07-05T00:00:00</noteDate>
<note>Following dean&apos;s email of  6/17/11 DHB/RAA agreed candidate to be sent a regret ltr (DHB advised check with TV re: OK to received regret ltr in light of  phone screen; TV OK with regret ltr viw TC w/CA).  Regret ltr sent 7/5/2011.</note>
</tblNotes>
<tblNotes>
<noteID>667</noteID>
<CandID>166</CandID>
<noteDate>2011-01-01T00:00:00</noteDate>
<note>CEB to follow up with candidate at Feb 2011 onc conf</note>
</tblNotes>
<tblNotes>
<noteID>668</noteID>
<CandID>166</CandID>
<noteDate>2011-07-06T00:00:00</noteDate>
<note>Per TC w/CEB, based on conversation at Feb 2011 conference, it is unlikely candidate is interested in making a move - OK to close file.</note>
</tblNotes>
<tblNotes>
<noteID>669</noteID>
<CandID>303</CandID>
<noteDate>2011-07-13T00:00:00</noteDate>
<note>Candidate advised in email of 071311 to RAA that she has withdrawn application  (will focus on scholarship this semester)Ruth,

Thanks for the update.  I have decided to withdraw my application as I will need to focus on my scholarship this fall.  However, it was wonderful getting to meet you during this process.

Thanks again,

Jill
On 7/11/2011 3:42 PM, Ruth Anderson wrote:
&gt; Hi Jill,  I just wanted to let you know that Dean Gilliss has decided 
&gt; to set an anticipated date of hire for this position for Fall 2012.  
&gt; We plan to interview candidates this fall.  The committee will be 
&gt; evaluating the pool of candidates in the next couple of months, after 
&gt; which time we will be back in touch.  I wanted to let you know why you  
&gt; have not hear from us recently.  Ruth
&gt;
&gt; -----Original Message-----
&gt; From: Jill B. Hamilton [mailto:jhamilto@email.unc.edu]
&gt; Sent: Wednesday, June 08, 2011 1:57 PM
&gt; To: Ruth Anderson
&gt; Subject: Follow-up
&gt;
&gt; Hi Ruth,
&gt;
&gt; Nice to meet you in person.  I am attaching my most recent CV.
&gt;
&gt; Jill
&gt;


--
Jill B. Hamilton, PhD, RN
School of Nursing
University of North Carolina at Chapel Hill
5106 Carrington Hall, CB # 7460
Chapel Hill, NC 27599-7460
Phone: 919.843.5608
Cell:  919.428.5354
Fax: 919.843.9900
Email: jhamilto@email.unc.edu</note>
</tblNotes>
<tblNotes>
<noteID>670</noteID>
<CandID>328</CandID>
<noteDate>2011-08-01T00:00:00</noteDate>
<note>In email of 7/24/11, applicant indicates interest in being considered for junior or senior researcher position.  Committee recommends regret ltr; regret ltr sent 8/4/11.</note>
</tblNotes>
<tblNotes>
<noteID>671</noteID>
<CandID>269</CandID>
<noteDate>2011-07-25T00:00:00</noteDate>
<note>Following TW phone screen, committee was in support (via email) of campus visit recommendation; campus visit to be scheduled</note>
</tblNotes>
<tblNotes>
<noteID>672</noteID>
<CandID>316</CandID>
<noteDate>2011-07-11T00:00:00</noteDate>
<note>Followwing review, RAA suggested Dr. Daraz might be a fit for the Informatics position; materials forwarded to CMJ for review.  CMJ comments:  similar candidate as Jina Huh, new PHD, narrow informatics focus (information science rather than informatics) would prefer candidate with broader informatics exp given interdisciplinarity of informatics at Duke</note>
</tblNotes>
<tblNotes>
<noteID>673</noteID>
<CandID>330</CandID>
<noteDate>2011-08-01T00:00:00</noteDate>
<note>TW to do phone screen.</note>
</tblNotes>
<tblNotes>
<noteID>674</noteID>
<CandID>326</CandID>
<noteDate>2011-08-01T00:00:00</noteDate>
<note>MVR to review CV; MVR supports recruitment of candidate; campus visit scheduled for 8/9</note>
</tblNotes>
<tblNotes>
<noteID>675</noteID>
<CandID>299</CandID>
<noteDate>2011-08-01T00:00:00</noteDate>
<note>MVR to review CV; MVR supports recruitment of candidate; TV to do phone screen.</note>
</tblNotes>
<tblNotes>
<noteID>676</noteID>
<CandID>325</CandID>
<noteDate>2011-08-01T00:00:00</noteDate>
<note>Following CEB&apos;s report of phone screen with candidate, committee recommends regret ltr; regret ltr sent 8/4/2011</note>
</tblNotes>
<tblNotes>
<noteID>677</noteID>
<CandID>284</CandID>
<noteDate>2011-08-01T00:00:00</noteDate>
<note>committee recommends regret ltr; 8/4/2011:  MEZ advised that candidate accepted another position via email of 7/3/2011</note>
</tblNotes>
<tblNotes>
<noteID>678</noteID>
<CandID>323</CandID>
<noteDate>2011-08-01T00:00:00</noteDate>
<note>TDW to do phone screen and check on defense date and we will continue recruitment of other candidates.</note>
</tblNotes>
<tblNotes>
<noteID>679</noteID>
<CandID>324</CandID>
<noteDate>2011-08-01T00:00:00</noteDate>
<note>SLD to do phone screen and sort out appointment track desires.</note>
</tblNotes>
<tblNotes>
<noteID>680</noteID>
<CandID>321</CandID>
<noteDate>2011-08-01T00:00:00</noteDate>
<note>regret ltr sent 8/19/ 2011</note>
</tblNotes>
<tblNotes>
<noteID>681</noteID>
<CandID>331</CandID>
<noteDate>2011-08-01T00:00:00</noteDate>
<note>AV to do phone screen</note>
</tblNotes>
<tblNotes>
<noteID>682</noteID>
<CandID>316</CandID>
<noteDate>2011-08-01T00:00:00</noteDate>
<note>Committee recommends regret ltr; regret ltr sent 8/4/2011</note>
</tblNotes>
<tblNotes>
<noteID>683</noteID>
<CandID>319</CandID>
<noteDate>2011-08-01T00:00:00</noteDate>
<note>CEB to do phone screen</note>
</tblNotes>
<tblNotes>
<noteID>684</noteID>
<CandID>327</CandID>
<noteDate>2011-08-01T00:00:00</noteDate>
<note>SLD to call candidate to discussFall 2012 start date, post doc</note>
</tblNotes>
<tblNotes>
<noteID>685</noteID>
<CandID>299</CandID>
<noteDate>2011-05-02T00:00:00</noteDate>
<note>Hold - pending outcome of Aselage and Davis</note>
</tblNotes>
<tblNotes>
<noteID>686</noteID>
<CandID>304</CandID>
